App ID,Name,Short Description,Developer,Publisher,Genre,Tags,Type,Categories,Owners,Positive Reviews,Negative Reviews,Price,Initial Price,Discount,CCU,Languages,Platforms,Release Date,Required Age,Website,Header Image
802890,Muv-Luv Alternative (マブラヴ オルタネイティヴ),Playtime's over. Time for despair. Experience the definitive version of a masterpiece in the Muv-Luv trilogy's thrilling conclusion. Note: therapy not included.,aNCHOR Inc.,aNCHOR Inc.,"Adventure, Casual","Visual Novel: 164, Anime: 143, Mechs: 142, War: 138, Sexual Content: 128, Violent: 124, Story Rich: 122, Gore: 119, Sci-fi: 116, Adventure: 113, Post-apocalyptic: 112, Psychological Horror: 111, Casual: 103, Crowdfunded: 102, Romance: 100, Military: 99, Kickstarter: 96, Singleplayer: 95, Choose Your Own Adventure: 89, Cute: 86",game,"Single-player, Steam Achievements, Steam Cloud, Steam Trading Cards","20,000 .. 50,000",1805,83,3999,3999,0,36,"English, Japanese, Simplified Chinese",windows,2018/02/28,0,http://www.muvluv.moe,https://cdn.akamai.steamstatic.com/steam/apps/802890/header.jpg?t=1665025480
1985260,Kinkoi: Golden Time,"Welcome to Noble Private Academy, an institution that cultivates the wealthiest, most well-connected students in all of Japan! At this boarding school, one must be willing to accept all of its refined and dignified teachings or be met with strict opposition!",Saga Planets,"NekoNyan Ltd., HIKARI FIELD","Adventure, Simulation","Visual Novel: 59, Adventure: 56, Romance: 50, Cute: 47, Anime: 43, Multiple Endings: 42, Nudity: 39, Sexual Content: 37, Simulation: 36, Funny: 29, Drama: 28, Singleplayer: 23, Story Rich: 23, Choices Matter: 22, Hentai: 13, Mature: 11, NSFW: 8",game,"Single-player, Steam Achievements, Steam Cloud","0 .. 20,000",256,4,2999,2999,0,11,"English, Japanese, Simplified Chinese, Traditional Chinese",windows,2022/07/15,0,,https://cdn.akamai.steamstatic.com/steam/apps/1985260/header.jpg?t=1657879154
1949270,Light Of The Past,Light Of The Past - 2D platformer in pixel style. Here you will need the ability to move well and think quickly.,Tripoid,  Gales Corp. ,Indie,"Dungeon Crawler: 406, Difficult: 401, Pixel Graphics: 399, Adventure: 395, Singleplayer: 393, Indie: 385",game,Single-player,"50,000 .. 100,000",12,2,2499,2499,0,1,English,windows,2022/05/6,0,,https://cdn.akamai.steamstatic.com/steam/apps/1949270/header.jpg?t=1654492150
1125490,STORM AREA 51: CUTE ALIEN GIRL EDITION,"Leaked documents suggest that the government is hiding aliens within Area 51 - CUTE GIRL ALIENS. Chads, Virgins, Kyles, and Otakus rise up and decide to raid Area 51 to get an alien girlfriend of their own. This is their story.",WASABAE Studios,WASABAE Studios,"Action, Adventure, Indie, Simulation, Strategy","Indie: 21, Action: 20, Violent: 20, Adventure: 19, Simulation: 19, Strategy: 19, Memes: 14, First-Person: 12, FPS: 11, Singleplayer: 11, Aliens: 10, Exploration: 10, Illuminati: 10, Replay Value: 10, Sci-fi: 10, Shooter: 10, Difficult: 9, Fast-Paced: 9, Military: 9, Tactical: 9",game,"Single-player, Steam Achievements","0 .. 20,000",11,4,199,199,0,0,English,windows,2019/08/3,0,,https://cdn.akamai.steamstatic.com/steam/apps/1125490/header.jpg?t=1667047022
312520,Rain World,"You are a nomadic slugcat, both predator and prey in a broken ecosystem. Grab your spear and brave the industrial wastes, hunting enough food to survive, but be wary— other, bigger creatures have the same plan... and slugcats look delicious.",Videocult,Akupara Games,"Action, Adventure, Indie","Atmospheric: 303, Difficult: 287, Survival: 287, Platformer: 240, Indie: 223, Pixel Graphics: 206, 2D: 198, Exploration: 198, Adventure: 196, Post-apocalyptic: 179, Great Soundtrack: 154, Open World: 150, Cute: 149, Singleplayer: 134, Action: 119, Metroidvania: 118, Survival Horror: 116, Souls-like: 110, Physics: 108, Stealth: 105",game,"Multi-player, Single-player, Steam Achievements, Full controller support, Shared/Split Screen PvP, Remote Play on TV, Remote Play Together, PvP","500,000 .. 1,000,000",7053,661,1999,1999,0,126,"English, Italian, Spanish - Spain, Portuguese - Brazil, French, German",windows,2017/03/28,0,https://www.akuparagames.com/game/rain-world/,https://cdn.akamai.steamstatic.com/steam/apps/312520/header.jpg?t=1667874002
1950310,Until The End,"In Until The End, you play as Zoe, a young nurse who has just graduated. At the Montagne Institute, you will help her make the best decisions for the well-being of her patients in a palliative care unit.",Red Sorel Games,Red Sorel Games,"Indie, Simulation","Visual Novel: 320, Choices Matter: 314, Medical Sim: 310, Simulation: 309, Interactive Fiction: 305, Pixel Graphics: 299, Adventure: 282, Life Sim: 274, 2D: 265, Choose Your Own Adventure: 255, Cute: 244, Drama: 233, Philosophical: 221, Supernatural: 207, Emotional: 205, Funny: 189, Minimalist: 172, Atmospheric: 154, Comedy: 135, Dark Humor: 115",game,Single-player,"0 .. 20,000",6,2,499,499,0,0,"English, French",windows,2022/09/1,0,,https://cdn.akamai.steamstatic.com/steam/apps/1950310/header.jpg?t=1662030925
1681480,The Repairing Mantis,"The Repairing Mantis is a narrative horror game that lets you experience the disturbing, violent (yet absurdly poetic) nightmare of a mantis on a mission to repair a bridge made of flying squirrel flesh.",Erupting Avocado,Erupting Avocado,"Adventure, Indie","Exploration: 176, Horror: 173, Walking Simulator: 166, Psychological Horror: 164, Adventure: 157, Atmospheric: 155, Story Rich: 144, First-Person: 131, Surreal: 124, Narrative: 113, Choices Matter: 102, Multiple Endings: 100, Violent: 94, Mystery: 87, Retro: 58, Gore: 46, Singleplayer: 43, Short: 27, Indie: 22",game,"Single-player, Steam Achievements","0 .. 20,000",54,3,599,599,0,1,"English, French, German",windows,2021/09/17,0,https://eruptingavocado.com/,https://cdn.akamai.steamstatic.com/steam/apps/1681480/header.jpg?t=1661796864
542240,TZOMPANTLI,"TZOMPANTLI is a fast paced fighting game based on the comic books written and drawn by Mexican author Edgar Clément, about Angel Hunters, Archangels, Nahuales, Mexican policemen, japanese robots and ancient demons as they battle each other trying to collect the price on the Head of the Archangel Michael .",Deathly Ideas,Deathly Ideas,"Nudity, Violent, Action, Indie, Early Access","Action: 32, Indie: 31, Early Access: 21, Nudity: 20, Violent: 20, Fighting: 16, Comic Book: 9, 2D Fighter: 6",game,"Multi-player, Single-player, Partial Controller Support, Shared/Split Screen, Remote Play Together","0 .. 20,000",17,12,999,999,0,1,"Spanish - Spain, English","windows, mac",2016/11/9,0,https://tzompantligame.com,https://cdn.akamai.steamstatic.com/steam/apps/542240/header.jpg?t=1579113119
837270,Tharn,"Do you have what it takes to beat the Tharn? Solve puzzles, crack codes, hack computers, smash glass, or just make a mess for the heck of it.",Matthew Wester,Mwester Studios,Indie,Indie: 21,game,Single-player,"0 .. 20,000",4,2,99,99,0,0,English,windows,2018/05/17,0,,https://cdn.akamai.steamstatic.com/steam/apps/837270/header.jpg?t=1526582301
1502990,Atelier Lydie & Suelle: The Alchemists and the Mysterious Paintings DX,"The definitive edition of the Atelier &quot;Mysterious&quot; series at a new price, with brand new content and various DLCs! &quot;Atelier Lydie &amp; Suelle&quot; is the 3rd instalment: after discovering a mysterious painting, Lydie &amp; Suelle get closer to their dream of running the best atelier.","KOEI TECMO GAMES CO., LTD.","KOEI TECMO GAMES CO., LTD.",RPG,"RPG: 34, Female Protagonist: 20, JRPG: 20, Cute: 15, Adventure: 14, Fantasy: 14, Anime: 13",game,"Single-player, Partial Controller Support, Steam Achievements, Steam Cloud","0 .. 20,000",155,10,3999,3999,0,31,"English, Simplified Chinese, Traditional Chinese, Japanese",windows,2021/04/21,0,https://www.koeitecmoamerica.com/mysteriousdx/,https://cdn.akamai.steamstatic.com/steam/apps/1502990/header.jpg?t=1661763665
975410,VESTIGE,"VESTIGE is a room-scale VR documentary that uses volumetric capture to take the viewer on a journey into the mind of Lisa as she remembers her lost love. Within an empty void, fragments of past memories appear of their life together and eventually lead us to the shocking moment of Erik’s death.",NSC Creative,"Other Set, NSC Creative, Atlas V, Kaleidoscope, RYOT","Casual, Indie","Sexual Content: 24, Casual: 21, Indie: 21, Narrative: 10, VR: 9, VR Only: 1",game,Single-player,"0 .. 20,000",26,7,499,499,0,0,"English, French",windows,2018/11/30,0,http://vestige-vr.com/,https://cdn.akamai.steamstatic.com/steam/apps/975410/header.jpg?t=1549914444
708190,Code World,"In Code World you control the robot that can walk around the world and send messages to devices. Every device reacts on those messages according to its code. You will have to read this code, understand what messages to send and write your own code.",Fewjix,Fewjix,Indie,"Programming: 85, Hacking: 79, Automation: 76, Text-Based: 73, Education: 70, Simulation: 64, Puzzle: 62, Logic: 54, 2D: 52, Singleplayer: 50, Indie: 48, Horror: 27",game,Single-player,"0 .. 20,000",29,8,499,499,0,0,English,windows,2017/09/11,0,,https://cdn.akamai.steamstatic.com/steam/apps/708190/header.jpg?t=1586601549
916950,Awesome Pea,Help the greedy Pea to make his way through a string of levels filled with deadly traps and cute but dangerous enemies and collect all the coins to which he can only reach!,PigeonDev,PigeonDev,"Adventure, Indie","Indie: 76, Adventure: 70, Platformer: 67, Pixel Graphics: 65, 2D: 64, Retro: 55, Difficult: 54, 2D Platformer: 51, Side Scroller: 47, Mystery Dungeon: 45, Precision Platformer: 43, 2.5D: 37, Cute: 36, Stylized: 33, 1980s: 31, Singleplayer: 29, Short: 27",game,"Single-player, Partial Controller Support, Steam Achievements","0 .. 20,000",67,10,499,499,0,0,"English, Russian, German, Spanish - Spain",windows,2018/09/19,0,,https://cdn.akamai.steamstatic.com/steam/apps/916950/header.jpg?t=1668057171
1269820,Kozue's Strange Journey,"Having barely escaped with her life after being attacked by shadowy monsters, Kozue, and the woman who helped save her decide to team up to investigate the creatures and their connection to reports of mysterious disappearances around town.",Asakiyumemishi,Kagura Games,"Indie, RPG","RPG: 86, Indie: 83, Anime: 36, Female Protagonist: 25, JRPG: 22, Sexual Content: 15, Multiple Endings: 13, Memes: 10, RPGMaker: 10, Nudity: 6",game,"Single-player, Steam Cloud","0 .. 20,000",162,18,1499,1499,0,2,"English, Simplified Chinese, Japanese",windows,2020/08/6,0,,https://cdn.akamai.steamstatic.com/steam/apps/1269820/header.jpg?t=1666343950
1745710,"Cato, the cat",Take care of Cato using a match 3 mechanic and don't let him get away.,Creativer Game Studio,Creativer Game Studio,Casual,"Match 3: 81, Cats: 76, Pixel Graphics: 70, Puzzle: 70, Cute: 66, 2D: 60, Relaxing: 57, Casual: 54, Colorful: 46, Family Friendly: 43, Minimalist: 36, Tabletop: 29, Singleplayer: 27",game,"Single-player, Stats, Steam Achievements, Steam Leaderboards","0 .. 20,000",18,1,99,99,0,0,"English, Simplified Chinese, Korean, Japanese, Portuguese - Brazil",windows,2022/01/21,0,,https://cdn.akamai.steamstatic.com/steam/apps/1745710/header.jpg?t=1662558803
1113340,Mr  Joshua Carrot,Mr Joshua Carrot&quot; является уникальным 2D платформером с головоломками и уникальными авторскими рисунками в стиле граффити.,Aleksei Yarovozov,Aleksei Yarovozov,Adventure,"Adventure: 80, Psychological: 11, Singleplayer: 11, Action-Adventure: 10, Design & Illustration: 10",game,Single-player,"0 .. 20,000",6,2,99,99,0,0,"English, Russian",windows,2020/01/1,0,,https://cdn.akamai.steamstatic.com/steam/apps/1113340/header.jpg?t=1621336955
797070,Bunny adventure,"Bunny adventure is fun, casual platformer for all ages.",CASGames,CASGames,"Adventure, Casual","Adventure: 21, Casual: 21",game,Single-player,"0 .. 20,000",23,14,99,99,0,0,English,windows,2018/02/14,0,,https://cdn.akamai.steamstatic.com/steam/apps/797070/header.jpg?t=1518601833
959280,Total Seclusion,"Total Seclusion is a FPS/Tower defence survival game set in the 1950’s. Play as Roy, A stranded survivor in the middle of the ocean after a fishing trip gone wrong.",Worldgame entertainment,Worldgame entertainment,"Action, Indie","Action: 31, Indie: 31, Free to Play: 5",game,"Single-player, Steam Achievements, Full controller support","0 .. 20,000",6,12,0,0,0,0,"English, Russian",windows,2019/12/10,0,,https://cdn.akamai.steamstatic.com/steam/apps/959280/header.jpg?t=1575981580
1536830,41 Hours: Prologue,"41 Hours is a first-person shooter dramatic game that follows the narrative of Ethan, a workaholic scientist in search of his long-lost wife. This is a one-hour prologue of the incredible, action-packed journey.",Texelworks,ValkyrieInitiative,Action,"FPS: 394, Dystopian : 387, Sci-fi: 384, Post-apocalyptic: 378, Gun Customization: 372, Exploration: 361, Hidden Object: 352, Sandbox: 347, Shooter: 338, Action RPG: 328, Action-Adventure: 317, 3D: 305, First-Person: 292, Alternate History: 279, On-Rails Shooter: 264, Action: 249, Story Rich: 248, Open World: 247, Military: 211, Stealth: 190",game,Single-player,"20,000 .. 50,000",29,27,0,0,0,0,"English, Russian, Simplified Chinese",windows,2021/03/19,0,https://valkyrieinitiative.pro/,https://cdn.akamai.steamstatic.com/steam/apps/1536830/header.jpg?t=1649862749
1835810,Amelie,"A psychological mystery yuri visual novel about a girl named Amelie. Forbidden from leaving the house, Amelie awaits the arrival of her long time penpal, Sofia, to her dear friend Lilika’s dismay. What secrets will Sofia unravel that were best kept buried?",Two and a Half Studios,Two and a Half Studios,"Indie, Simulation","Visual Novel: 131, Anime: 125, Horror: 121, Female Protagonist: 117, Mystery: 112, LGBTQ+: 106, Psychological: 104, Psychological Horror: 101, Thriller: 101, Atmospheric: 97, Dark: 95, Linear: 93, 2D: 91, Multiple Endings: 84, Story Rich: 82, Simulation: 72, Choose Your Own Adventure: 70, Singleplayer: 64, Indie: 48, Short: 27",game,Single-player,"0 .. 20,000",119,3,399,399,0,0,"English, Simplified Chinese","windows, mac",2021/12/15,0,,https://cdn.akamai.steamstatic.com/steam/apps/1835810/header.jpg?t=1665802482
246760,Legends of Eisenwald,"Legends of Eisenwald is an adventure game with tactical battles, RPG and strategy elements. Take the lead of a small feudal army and try to defend your right to survive in this ruthless medieval world.",Aterdux Entertainment,Aterdux Entertainment,"Adventure, Indie, RPG, Strategy","Tactical RPG: 208, Turn-Based: 207, Choices Matter: 203, Strategy RPG: 193, Choose Your Own Adventure: 187, Story Rich: 181, Multiple Endings: 179, Character Customization: 172, Medieval: 169, Difficult: 163, Third Person: 157, 3D: 156, Inventory Management: 148, Level Editor: 146, Tactical: 142, RPG: 140, Strategy: 139, Turn-Based Strategy: 129, Historical: 123, Turn-Based Combat: 118",game,"Single-player, Includes level editor, Steam Achievements, Steam Cloud, Steam Trading Cards, Steam Workshop","100,000 .. 200,000",1271,388,1999,1999,0,9,"English, German, Russian, French, Spanish - Spain, Italian, Simplified Chinese, Belarusian",windows,2015/07/2,0,http://legendsofeisenwald.com,https://cdn.akamai.steamstatic.com/steam/apps/246760/header.jpg?t=1663584490
852790,The Adventure of Magical Girl,"Magical Girl + JRPG! The mercenaries Kaim and Asal are unable to get used to the court life, so they give up their lordship and continue to wander around, living by eating grass as mercenaries. But their boring routine is broken again. They would meet the three students from the magic academy.",Windward_Birds,XNZONE,"Adventure, Casual, Indie, RPG","JRPG: 209, RPGMaker: 204, Cute: 200, Gothic: 198, Female Protagonist: 193, Fantasy: 189, Funny: 185, Exploration: 183, Visual Novel: 179, Anime: 174, Third Person: 171, Turn-Based: 160, Adventure: 158, RPG: 152, 2D: 151, Family Friendly: 148, Magic: 145, Casual: 143, Comedy: 141, Pixel Graphics: 139",game,"Single-player, Captions available, Partial Controller Support, Steam Achievements, Steam Cloud","50,000 .. 100,000",104,17,299,299,0,0,"Simplified Chinese, English, Traditional Chinese",windows,2018/06/21,0,,https://cdn.akamai.steamstatic.com/steam/apps/852790/header.jpg?t=1622598908
1355590,War Machine,War Machine is a First Person Shooter in which a soldier (Ryan) has a mission to save the world from a machine revolution.,GN SoftWare,GN SoftWare,"Action, Adventure, Casual","Action: 66, Adventure: 59, Casual: 57, FPS: 34, Action-Adventure: 33, First-Person: 26, Sci-fi: 24, Open World: 21, Singleplayer: 19",game,"Single-player, Steam Cloud","0 .. 20,000",0,1,599,599,0,0,English,windows,2020/07/21,10,https://pt.gnsoftware.net/,https://cdn.akamai.steamstatic.com/steam/apps/1355590/header.jpg?t=1628961298
1586930,Extreme racing,"Extreme racing is a wonderful racing game in which you will enjoy spending your time and at the same time test your driving skills in a cool racing mode! If you are attracted to the big magical world of speed and off-scale adrenaline, then the game &quot;Extreme racing&quot; is just for you!",PHX games,PHX games,"Indie, Racing, Simulation, Sports","Racing: 71, Simulation: 62, Sports: 44, Automobile Sim: 39, Vehicular Combat: 37, Driving: 34, Arcade: 27, Transportation: 27, Top-Down: 23, Indie: 21, PvE: 20, Singleplayer: 18, 2D: 17",game,Single-player,"0 .. 20,000",2,5,999,999,0,0,"English, Russian",windows,2021/04/29,0,,https://cdn.akamai.steamstatic.com/steam/apps/1586930/header.jpg?t=1619680700
422760,Ocean Rift,"Ocean Rift is the world's first VR aquatic safari park. Explore a vivid underwater world full of life including dolphins, sharks, orcas, turtles, sea snakes, rays, manatees, sea lions, whales, and even dinosaurs!",Llyr ap Cenydd,Picselica Ltd,"Adventure, Casual, Indie","Casual: 24, Adventure: 23, Indie: 22, VR: 11, Underwater: 7, VR Only: 1",game,Single-player,"0 .. 20,000",95,25,999,999,0,1,English,windows,2017/09/13,0,http://www.facebook.com/oceanriftvr,https://cdn.akamai.steamstatic.com/steam/apps/422760/header.jpg?t=1517860245
2140590,Cat and Watermouse,"Cat and Watermouse is an old school 2d platformer with endless runner mechanics. Can you dodge the obstacles, defeat your enemy, and forge a new alliance along the way?",ROBObermann,ROBObermann,"Action, Adventure","Action: 215, Adventure: 209, Platformer: 185, 2D Platformer: 180, Precision Platformer: 174, Runner: 164, 2D: 157, Cartoony: 149, Cute: 141, Pixel Graphics: 132, Family Friendly: 121, Mystery: 119, Old School: 106, Artificial Intelligence: 92, Controller: 77, Physics: 61, PvE: 44, Tutorial: 28, Singleplayer: 26",game,"Single-player, Partial Controller Support","0 .. 20,000",2,1,199,199,0,0,English,windows,2022/09/21,0,,https://cdn.akamai.steamstatic.com/steam/apps/2140590/header.jpg?t=1663775469
1015720,Alternate DiMansion Diary,"A university student named Sae finds herself lost in the mountains. While searching for help, she comes across an old looking mansion and decides to enter it. However, there was more to this mansion than meets the eye. What will become of Sae? Find out in this Puzzle-Escape RPG!",Sprite Hills,Kagura Games,"Adventure, Indie, RPG","Nudity: 72, Sexual Content: 67, Adventure: 60, Indie: 54, RPG: 46, Female Protagonist: 45, Pixel Graphics: 39, Anime: 30, Multiple Endings: 20, Puzzle: 19, JRPG: 17, Funny: 10, Horror: 8, Memes: 8, RPGMaker: 7, Hentai: 6",game,"Single-player, Steam Cloud","20,000 .. 50,000",322,43,999,999,0,1,"English, Simplified Chinese",windows,2019/05/23,0,,https://cdn.akamai.steamstatic.com/steam/apps/1015720/header.jpg?t=1666343158
1730030,Skeleton Troubles,"Skeleton troubles - This platformer will put on your shoulders an unusual task - resurrect your skeleton hero, collecting bones and hearts in the dungeon so that he regains his strength and teach all his enemies a lesson. Jump over the spikes, dodge the cunning slugs that will shoot at you and run to victory!",TAUNT,Gales Corp.,"Adventure, Indie","2D: 676, Pixel Graphics: 668, Singleplayer: 657, Indie: 653, Adventure: 473, Cute: 245, Logic: 240",game,Single-player,"100,000 .. 200,000",3,4,499,499,0,0,English,windows,2021/09/5,0,,https://cdn.akamai.steamstatic.com/steam/apps/1730030/header.jpg?t=1633329937
1364130,Chaotic Airport Construction Manager,A simulation game making fun of Germans needing 16 years to build an airport. Are you able to do better?,Illusive Reflection,Steckenpferd Enterprises,"Simulation, Strategy","Simulation: 330, Satire: 326, Strategy: 322, Comedy: 318, Funny: 313, Text-Based: 289, Parody : 283, Building: 282, Crafting: 266, Management: 260, City Builder: 244, Minimalist: 233, Education: 221, Politics: 210, Political: 206, Tactical: 190, Economy: 176, Memes: 159, Tutorial: 134, 3D: 115",game,"Single-player, Steam Achievements, Steam Cloud, Remote Play Together","20,000 .. 50,000",196,22,799,799,0,0,"English, German","windows, mac, linux",2020/09/17,0,https://illusive-reflection.com/,https://cdn.akamai.steamstatic.com/steam/apps/1364130/header.jpg?t=1667576251
1277480,The Shepherd,"After finding an old picture of your grandfather on a camel, you decide to leave the city and set off into the serenity of the desert. In order to become a great rider, just like he was. Train your herd, befriend desert-folk, fight predators, and navigate the mysteries of the desert.",MW Hashem,MeemWow Games,"Indie, RPG, Simulation","RPG: 66, Turn-Based Combat: 52, Exploration: 43, Singleplayer: 40, Rogue-lite: 37, Simulation: 33, Indie: 31, Strategy RPG: 31, Nature: 29, Immersive Sim: 26, Mystery: 25, Atmospheric: 23, Resource Management: 21, 2D: 19, Multiple Endings: 15",game,Single-player,"0 .. 20,000",5,1,1099,1099,0,0,"English, Arabic","windows, mac",2022/03/22,0,,https://cdn.akamai.steamstatic.com/steam/apps/1277480/header.jpg?t=1647963637
523410,Ozapell Basic,Ozapell Basic is a hobbyist programming language simple enough for new programmers -- while powerful enough to develop playable retro 1980s games.,Ozapell,Ozapell,"Animation & Modeling, Audio Production, Design & Illustration, Education, Software Training, Video Production","Design & Illustration: 33, Software Training: 33, Education: 22, Animation & Modeling: 21, Audio Production: 21, Video Production: 20, Programming: 15, Game Development: 14, Retro: 13, Family Friendly: 11, Pixel Graphics: 11",game,,"0 .. 20,000",9,4,999,999,0,0,English,windows,2017/10/23,0,http://www.ozapell.com/,https://cdn.akamai.steamstatic.com/steam/apps/523410/header.jpg?t=1517338929
966610,FPS Monitor – hardware in-game & desktop overlays,"FPS Monitor tracks your PC's hardware state and displays this information as an overlay in-game or over desktop. Does not require configuration, it works immediately after installation.",Eduard Kozadaev,Eduard Kozadaev,"Utilities, Video Production, Web Publishing, Game Development","Utilities: 27, Web Publishing: 22, Video Production: 21, Game Development: 20, FPS: 6, Software: 5",game,,"50,000 .. 100,000",1174,183,1199,1199,0,193,"English, Italian, Hungarian, Korean, Portuguese - Brazil, Russian, Thai",windows,2018/11/9,0,https://fpsmon.com,https://cdn.akamai.steamstatic.com/steam/apps/966610/header.jpg?t=1582381484
554470,BladeShield,"Survive wave after wave of enemy AI bots in this intergalactic VR game. Switch between shield and blade with the click of a button, charge up your light blade by blocking incoming laser bolts, and unleash a powerful EMP blast!","Rank17, Silicon Storm",Rank17,"Action, Casual","Action: 21, Casual: 21, VR: 9",game,"Single-player, Steam Leaderboards","0 .. 20,000",24,2,299,299,0,0,English,windows,2016/11/28,0,http://rank17.com,https://cdn.akamai.steamstatic.com/steam/apps/554470/header.jpg?t=1493885678
974320,Hentai Dreams,"The Raven... A wonderful place to go find food to eat and a bed to sleep in if your looking for a hentai themed B&amp;B. But wait there is no art in this place, Whats going on? It's your job as owner of &quot;The Raven&quot; to get art!",Squids Around,Squids Around,"Casual, Indie, Strategy",,game,"Single-player, Steam Achievements","0 .. 20,000",0,0,99,99,0,0,English,windows,2018/12/10,0,http://squidsaround.me/,https://cdn.akamai.steamstatic.com/steam/apps/974320/header.jpg?t=1559825944
1652510,Hard Steel,"Jump to the arena with your robot and show who's boss... watch out for traps, losing is easy but winning is not!",Prestige Games,Prestige Games,"Action, Adventure, Indie, Simulation, Sports, Early Access","Action: 57, ""Beat em up"": 51, Adventure: 48, Action-Adventure: 45, 3D: 44, Third Person: 41, Sports: 40, Atmospheric: 31, Combat: 28, Singleplayer: 25, Arcade: 23, Early Access: 22, Indie: 21, Simulation: 21, Combat Racing: 20, Destruction: 18, Robots: 17, Vehicular Combat: 14",game,Single-player,"0 .. 20,000",3,4,299,599,50,0,English,windows,2021/06/15,0,,https://cdn.akamai.steamstatic.com/steam/apps/1652510/header.jpg?t=1646069432
720300,Toran,"In this sci-fi puzzle adventure &quot;short game&quot; you are a scientist, stranded on a distant moon during an expedition to investigate alien remains. After finding a strange platform, what seemed to be a one way trip might turn into an intergalactic odyssey.",Really Interactive,Really Interactive,"Adventure, Free to Play, Indie","Indie: 44, Adventure: 34, Free to Play: 33, VR: 23, Short: 15, Singleplayer: 14, Atmospheric: 13, Futuristic: 13, Puzzle: 13, Sci-fi: 13, Beautiful: 12, Experimental: 12, Great Soundtrack: 12, Relaxing: 12, Space: 12",game,Single-player,"20,000 .. 50,000",203,13,0,0,0,0,English,windows,2019/04/18,0,https://really-interactive.se/,https://cdn.akamai.steamstatic.com/steam/apps/720300/header.jpg?t=1572862815
