App ID,Name,Short Description,Developer,Publisher,Genre,Tags,Type,Categories,Owners,Positive Reviews,Negative Reviews,Price,Initial Price,Discount,CCU,Languages,Platforms,Release Date,Required Age,Website,Header Image
676600,Fuzzy's Quest,"Its Fuzzy’s birthday today and wishes is to become a wizard. During his visit to the wizard’s palace, the evil Koodies invade the party his family were preparing. When Fuzzy returns, he finds his family have been kidnapped and his party ruined. He sets off on a mission. Will he find his family?",David J Noble,Noblesoft Developments Limited,"Action, Adventure, Casual, Indie","Action: 177, Casual: 171, Indie: 168, Adventure: 165, Singleplayer: 162, Platformer: 155, Arcade: 153, 3D Platformer: 149, Side Scroller: 142, 2.5D: 133, 3D: 122, Cartoon: 120, Colorful: 107, Cute: 94, Atmospheric: 85, Comedy: 82, Family Friendly: 69, Fantasy: 55, Funny: 40, Old School: 27",game,"Single-player, Stats, Partial Controller Support, Steam Achievements","0 .. 20,000",1,0,199,199,0,0,English,windows,2020/01/1,0,,https://cdn.akamai.steamstatic.com/steam/apps/676600/header.jpg?t=1656180118
281560,D.W.A.R.F.S.,"D.W.A.R.F.S. is an abbreviation for Dapper Wacky Although Rather Fierce Squad. Welcome to the Magic Forest! Whenever there is trouble, every single animal, big or small, can count on the dwarves’ help. Although it may seem like the squad prefers relaxation to work, the dwarves are the greatest rescue unit in the Magic Forest, and they...",ZSK Progres s.c.,Strategy First,Adventure,"Adventure: 26, Puzzle: 5",game,Single-player,"0 .. 20,000",9,9,119,599,80,0,English,windows,2014/03/20,0,http://www.strategyfirst.com/games/1635-d-w-a-r-f-s.html,https://cdn.akamai.steamstatic.com/steam/apps/281560/header.jpg?t=1574189799
834070,AI Escort,"This is an Otome visual nove, it is a satire on highly developed industrial technology in Japan, in which the decline of human civilization, moral decays, and low birth rate gets out of control under the huge social pressure. Someday, Ruri picked up Aizen.",MagicHouse,Paradise Project,"Indie, RPG","Indie: 33, RPG: 29, Otome: 10, RPGMaker: 9, Anime: 8, Visual Novel: 8, Sexual Content: 6",game,"Single-player, Steam Cloud","0 .. 20,000",86,47,0,0,0,0,"English, Traditional Chinese",windows,2018/04/12,0,,https://cdn.akamai.steamstatic.com/steam/apps/834070/header.jpg?t=1616008554
1709460,Hot And Lovely 4,"A very interesting puzzle game. You need to remember the different pictures by flipping the cards, and find the same pictures to eliminate.",Lovely Games,Lovely Games,"Action, Casual, Indie, Strategy","Strategy: 193, Casual: 190, Dating Sim: 159, Visual Novel: 153, Exploration: 150, 2D: 148, Anime: 142, Cartoony: 128, Cute: 122, Drama: 107, Relaxing: 99, Funny: 85, Romance: 68, Sexual Content: 68, Nudity: 47, Family Friendly: 42, Story Rich: 33, Singleplayer: 27, Action: 21, Indie: 21",game,"Single-player, Steam Achievements","0 .. 20,000",131,31,199,199,0,0,"English, Russian, Japanese, Simplified Chinese, Traditional Chinese, Korean",windows,2021/09/15,0,,https://cdn.akamai.steamstatic.com/steam/apps/1709460/header.jpg?t=1646728241
363070,Let's Explore the Jungle (Junior Field Trips),"No place on Earth is more mysterious or exciting than a jungle. Explore the dim interior of an Amazon cave. Dive into a river and take a swim with a hippo. View the inner workings of an underground ant nest. With Let's Explore the Jungle, children become involved and intrigued from the very first scene.",Humongous Entertainment,"Humongous Entertainment, Nightdive Studios",Casual,"Casual: 34, Education: 7, Family Friendly: 6",game,"Single-player, Steam Cloud","20,000 .. 50,000",25,4,699,699,0,2,English,"windows, mac, linux",2015/04/24,0,http://www.humongous.com,https://cdn.akamai.steamstatic.com/steam/apps/363070/header.jpg?t=1578533606
724430,Knights Hunt,"Knights Hunt will take you on a immersive action rampage, where armed to the teeth, you can face up to few hundred knights at once!",Racing Bros,ANPA.US,"Action, Indie, Simulation","Indie: 25, Action: 23, Simulation: 20",game,"Multi-player, Single-player, Co-op, Steam Achievements, Cross-Platform Multiplayer, Online Co-op","20,000 .. 50,000",38,61,499,499,0,0,English,"windows, mac, linux",2018/03/20,0,https://anpa.us,https://cdn.akamai.steamstatic.com/steam/apps/724430/header.jpg?t=1656162858
1936000,The Infernal Return,"The Infernal Return is a role-playing adventure game. Welcome to Fengdu ghost city! Help Koward, a boy who was abducted to hell, find his way back to life. Acquire god powers, get through dungeons, visit others' dreams, and chase ghosts to escape from this hellish nightmare.",Knifish Games,"Knifish Studio, Angel Star Studios","Action, Adventure, RPG, Strategy","Exploration: 222, 3D Platformer: 216, Dungeon Crawler: 213, Hidden Object: 210, Sandbox: 207, RPG: 201, Puzzle: 199, Strategy RPG: 195, 3D: 190, First-Person: 182, Third Person: 175, Underground: 167, Dragons: 155, Story Rich: 147, Conversation: 140, Controller: 129, Linear: 121, Zombies: 118, Action: 110, Adventure: 108",game,"Single-player, Full controller support","0 .. 20,000",2,1,599,599,0,0,"English, Simplified Chinese, Traditional Chinese",windows,2022/09/10,0,http://knifish.wixsite.com/games,https://cdn.akamai.steamstatic.com/steam/apps/1936000/header.jpg?t=1665850343
1338770,Sniper Ghost Warrior Contracts 2,"SGW Contracts 2 is a modern warfare shooter set in the Middle East. Play as Raven, Contract Sniper Assassin, as you take out a series of targets across a dramatic single-player campaign. With extreme-range shots exceeding 1000m, gear up for the most challenging entry to the series yet.",Underdog Studio,CI Games,Action,"FPS: 232, Sniper: 220, Shooter: 214, Stealth: 208, Gun Customization: 189, Realistic: 187, Tactical: 180, Action: 174, Singleplayer: 171, Military: 166, First-Person: 164, War: 151, Physics: 146, Multiplayer: 142, Modern: 137, Combat: 125, Assassin: 111, 3D: 108, Gore: 108, Violent: 74",game,"Single-player, Partial Controller Support, Steam Achievements, Steam Cloud","200,000 .. 500,000",5735,1009,1999,3999,50,529,"English, French, Italian, German, Spanish - Spain, Korean, Polish, Russian, Simplified Chinese, Portuguese - Brazil, Czech, Japanese",windows,2021/06/4,0,,https://cdn.akamai.steamstatic.com/steam/apps/1338770/header.jpg?t=1664815422
977310,Sea Birds: End of an Age,"A minimalist, exploration game, based on the life of the pirate William Fly. Set sail on the high seas of a randomly generated world! Search both water and land for pieces of the treasure map, fighting anyone who stands in your way. Once you collect all four pieces you can uncover the treasure!",Kevin Adams,Kevin Adams,Indie,"Singleplayer: 85, Pirates: 79, 2D: 76, Adventure: 73, Minimalist: 70, Pixel Graphics: 64, Sailing: 62, Casual: 60, Retro: 58, Historical: 51, Indie: 48, Zombies: 27",game,Single-player,"0 .. 20,000",6,0,199,199,0,0,English,"windows, linux",2019/01/1,0,,https://cdn.akamai.steamstatic.com/steam/apps/977310/header.jpg?t=1640539453
938310,12 Labours of Hercules VIII: How I Met Megara,One day Hercules saw a girl who sobbed upon the shore. She told the young stranger that her sister and beloved cat had missed after the evil Cretans attacked Thebes. The only clue was a message on the wall… Hercules fell in love with that girl named Megara at the first sight...,"Jetdogs Studios, Zoom Out Games",Jetdogs Studios,"Adventure, Strategy","Strategy: 37, Adventure: 29, Time Management: 19, Casual: 17, Resource Management: 14, Singleplayer: 14, Puzzle: 13, Mythology: 12, Cats: 10, Cute: 10, Family Friendly: 10, Indie: 10, Mouse only: 10, Point & Click: 10",game,"Single-player, Steam Achievements, Steam Cloud","0 .. 20,000",132,5,299,299,0,4,"English, French, German, Russian","windows, mac",2018/12/26,0,,https://cdn.akamai.steamstatic.com/steam/apps/938310/header.jpg?t=1545824802
668360,Bokuten - Why I Became an Angel,"One day while practicing archery, Tomoe shoots an angel out of the sky. While he doesn't believe in love, the angel Aine literally sings its praises. Like it or not, Tomoe will have to help Aine play cupid to bring together all of the distressed couples they encounter.",OVERDRIVE,MangaGamer,Adventure,"Adventure: 32, Visual Novel: 25, Sexual Content: 22, Anime: 21, Emotional: 16, Mature: 16, Multiple Endings: 16, Choices Matter: 15, Drama: 14, Story Rich: 14, Atmospheric: 13, Cute: 13, Great Soundtrack: 13, Romance: 13, Casual: 12, Singleplayer: 12",game,"Single-player, Steam Cloud","0 .. 20,000",69,11,4499,4499,0,1,English,windows,2019/12/19,0,,https://cdn.akamai.steamstatic.com/steam/apps/668360/header.jpg?t=1596572547
886950,Roman The Worm,"Roman The Worm is a fun and tricky 2D Jump 'n' Run game. You are lost under the ground, surrounded by all kinds of creatures, bosses and challenges. Strong weapons and handy items will help you through your adventure of finding your family.",MediaTale,MediaTale,"Action, Adventure, Casual, Simulation","Casual: 31, Action: 30, Adventure: 30, Simulation: 29",game,"Single-player, Steam Achievements, Steam Cloud, Full controller support","0 .. 20,000",28,6,199,199,0,0,"English, German, Spanish - Spain, Polish, Russian, Turkish",windows,2018/07/17,0,https://mediatale.at,https://cdn.akamai.steamstatic.com/steam/apps/886950/header.jpg?t=1667020897
449690,Fatal Fight,"The legendary “two click” fighting technique returns! Get ready for even more explosive martial action with lavish, detailed graphics, stunning special effects, diverse enemies and environments.",Fighting Games,Fighting Games,"Action, Indie","Action: 25, Indie: 22, ""Beat em up"": 11, Fast-Paced: 11",game,"Single-player, Partial Controller Support, Steam Achievements, Steam Trading Cards","0 .. 20,000",46,15,299,299,0,0,"English, Portuguese - Portugal, Russian, Turkish",windows,2016/06/10,0,https://fightinggames.mobi,https://cdn.akamai.steamstatic.com/steam/apps/449690/header.jpg?t=1465635915
1551660,Gravity Mastery,"A perspective-disorienting puzzler where the definition of down is yours to decide. Change the flow of gravity to complete each of The Adviser's varied, but logical tests. Can you become proficient enough to control the six directions and master gravity?",RedZyrro,RedZyrro,Indie,"Puzzle: 54, Strategy: 46, 3D Platformer: 44, Indie: 42, Singleplayer: 41, Physics: 38, Puzzle-Platformer: 32, First-Person: 30, Family Friendly: 28, Time Attack: 26, 3D: 25, Linear: 20, Logic: 18, Abstract: 16, Minimalist: 14, Sci-fi: 12",game,"Single-player, Steam Achievements","0 .. 20,000",3,1,799,799,0,0,English,windows,2021/03/10,0,https://redzyrro.com/gravity-mastery/,https://cdn.akamai.steamstatic.com/steam/apps/1551660/header.jpg?t=1637687243
1091650,XMagicMouse,XMagicMouse is a funny and powerful mouse effect software that displays amazing animations and effects when you move your mouse or click anywhere.,XDesktopSoft,XDesktopSoft,"Animation & Modeling, Design & Illustration, Utilities, Early Access","Utilities: 22, Animation & Modeling: 21, Design & Illustration: 21, Early Access: 21",game,"Steam Cloud, Steam Workshop","20,000 .. 50,000",50,34,299,299,0,2,"English, Simplified Chinese, French, German, Japanese, Korean, Russian",windows,2019/06/5,0,http://xdesktop.com,https://cdn.akamai.steamstatic.com/steam/apps/1091650/header.jpg?t=1607489466
1492260,RECONNECT - The Heart of Darkness,"Prove yourself against a real machine learning AI that learns as you play! Build your base grid-free and defend it against a swarm of AI-controlled drones that get smarter with each attack. Reconnect the enemy base to get your own drones, train and command them in the final battle AI vs AI.",RobotHeart Lab,RobotHeart Lab,"Casual, Indie, Strategy, Early Access","Early Access: 165, Strategy: 150, Indie: 144, Relaxing: 141, Minimalist: 138, Base-Building: 135, Casual: 129, Controller: 127, Procedural Generation: 125, Artificial Intelligence: 122, Real Time Tactics: 119, Atmospheric: 113, Soundtrack: 111, RTS: 103, Singleplayer: 100, Building: 91, Rogue-like: 84, 3D: 80, Rhythm: 72, Space: 64",game,"Single-player, Steam Achievements, Steam Cloud, Full controller support","0 .. 20,000",7,1,1499,1499,0,0,English,windows,2021/06/10,0,https://www.robotheartlab.com/reconnect,https://cdn.akamai.steamstatic.com/steam/apps/1492260/header.jpg?t=1657390592
345340,The Grave Digger,Take control of shovel-master Fagus in this curious blend of whimsical English comedy and grim Dickensian horror.,Home Groan Games,Home Groan Games,"Action, Adventure, Indie","Action: 21, Adventure: 21, Indie: 21",game,"Single-player, Stats, Steam Achievements, Steam Cloud, Steam Leaderboards, Full controller support, Steam Trading Cards","0 .. 20,000",22,7,599,599,0,0,English,"windows, linux",2015/04/29,0,http://homegroangames.co.uk,https://cdn.akamai.steamstatic.com/steam/apps/345340/header.jpg?t=1572387069
1784470,Tightrope Walking,Tightrope Walking is a game where you can experience slacklining.,OZNA STUDIO,OZNA STUDIO,Simulation,"Simulation: 71, Puzzle: 45, Walking Simulator: 44, 3D: 41, Third Person: 38, Sports: 31, America: 29, Comedy: 27, Emotional: 25, Memes: 23, Nature: 21, Old School: 19, Relaxing: 17, Romance: 15, Singleplayer: 13",game,Single-player,"0 .. 20,000",14,5,299,299,0,0,"English, French, Italian, German, Spanish - Spain, Czech, Dutch, Japanese, Korean, Polish, Portuguese - Portugal, Russian, Simplified Chinese, Traditional Chinese",windows,2021/10/22,0,,https://cdn.akamai.steamstatic.com/steam/apps/1784470/header.jpg?t=1641903406
891520,Tranquil Garden,"The Character-Driven, Personal Playstyle RPG that places you in control of Juniper, Cedar, and Lily. Meet this world’s fun citizens, explore beautiful maps, and bond with your party members through Stat-Boosting Dialogue Prompts to gain abilities and become the Hero this world needs!",Glass Robot,Glass Robot,"Adventure, Casual, Indie, RPG, Strategy","RPG: 32, Casual: 31, Indie: 31, Adventure: 30, Strategy: 29",game,"Single-player, Partial Controller Support","0 .. 20,000",5,1,0,0,0,0,English,windows,2020/09/18,0,https://glassrobotgames.com/tranquil-garden,https://cdn.akamai.steamstatic.com/steam/apps/891520/header.jpg?t=1600528073
1926660,OUTLANDER,Outlander is a blocky platformer game that is fun for all ages.,IMPERIAL DYNAMICS,IMPERIAL DYNAMICS,"Adventure, Indie, RPG","Adventure: 67, Action: 53, Casual: 44, Action-Adventure: 41, Puzzle: 38, Rogue-like: 31, Choose Your Own Adventure: 30, Exploration: 28, Rogue-lite: 26, 2D: 24, Pixel Graphics: 22, Indie: 21, RPG: 21, Atmospheric: 20, Futuristic: 18, Crafting: 16, Singleplayer: 14, Survival: 12",game,Single-player,"0 .. 20,000",4,0,99,99,0,0,English,windows,2022/04/4,0,,https://cdn.akamai.steamstatic.com/steam/apps/1926660/header.jpg?t=1649064228
525420,Samplitude Music Studio 2017 Steam Edition,"Bring your music productions to life in the best possible quality. Samplitude Music Studio Steam Edition provides you with a complete professional solution for recording, composing, mixing and mastering your music.",MAGIX Software GmbH,MAGIX Software GmbH,Audio Production,Audio Production: 25,game,,"0 .. 20,000",19,16,0,0,0,2,"English, German",windows,2016/09/20,0,http://www.magix-audio.com,https://cdn.akamai.steamstatic.com/steam/apps/525420/header.jpg?t=1538761602
676340,Undarkened,"Undarkened is a PvE/PvP magic survival game, where you can hunt, explore, craft and more!",Colin Stoddart,Colin Stoddart,"Adventure, Indie, RPG","Adventure: 34, Indie: 33, RPG: 32, Survival: 15, Crafting: 14, Magic: 14, Open World: 14",game,"Multi-player, Single-player, Co-op, Online PvP, PvP","0 .. 20,000",9,3,499,499,0,1,English,windows,2017/10/23,0,,https://cdn.akamai.steamstatic.com/steam/apps/676340/header.jpg?t=1508813652
914510,Project Reset,"Play as a boy who got back from a 1 month vacation and has returned to school, only to find that he meets 3 new friends, and gets into a new hobby! Meet all 3 of these characters in Project Reset, a free visual novel!",Team Reset,Team Reset,"Free to Play, Indie","Free to Play: 35, Indie: 31, Visual Novel: 6",game,"Single-player, Partial Controller Support","0 .. 20,000",14,10,0,0,0,0,English,windows,2018/12/19,0,https://www.teamreset.net,https://cdn.akamai.steamstatic.com/steam/apps/914510/header.jpg?t=1585163447
302310,Dungeon of Elements,"Dungeon of Elements is an RPG dungeon crawler with combat inspired by some of our favorite classic puzzle games like Dr. Mario or Tetris. In Dungeon of Elements (DoE), core meets casual as we combine many different styles of gameplay in a fun, immersive experience.",Frogdice,Frogdice,"Adventure, Casual, Indie, RPG, Strategy","Casual: 64, RPG: 38, Indie: 36, Adventure: 35, Strategy: 35, Puzzle: 7",game,"Single-player, Stats, Steam Achievements, Steam Trading Cards","50,000 .. 100,000",109,120,999,999,0,5,English,"windows, mac, linux",2014/06/12,0,http://doe.frogdice.com,https://cdn.akamai.steamstatic.com/steam/apps/302310/header.jpg?t=1667860794
2066940,Sagger,"This is a free part of the Sagger game - historical simulator that will give you control over all Israel resources to face the Yom Kippur War. With the help of your advisor and knowledge, you will acquire, make the crucial decisions that will lead the state of Israel to Victory or Defeat.",Media Alliance Gaming Studio Sp. z o.o.,Media Alliance Gaming Studio Sp. z o.o.,"Simulation, Strategy","Strategy: 738, Simulation: 732, Education: 710, Politics: 622, Political Sim: 422, Immersive Sim: 415, Wargame: 413, 3D: 411, Minimalist: 408, Alternate History: 405, Historical: 401, Political: 397, War: 395, Story Rich: 393, Multiple Endings: 391, Resource Management: 386, Choices Matter: 383, Singleplayer: 381, Grand Strategy: 379, Interactive Fiction: 374",game,Single-player,"0 .. 20,000",4,1,4499,4499,0,1,English,windows,2022/10/2,0,https://sagger.com/,https://cdn.akamai.steamstatic.com/steam/apps/2066940/header.jpg?t=1665577983
1015890,TASOMACHI: Behind the Twilight,"Yukumo is a young girl traversing the world in her beloved airship. Upon arriving at a certain town, her airship breaks down. She decides to explore the town to search for parts for repair; however, the town has fallen silent, with no trace of its inhabitants...",Orbital Express,PLAYISM,"Action, Adventure","Relaxing: 220, Atmospheric: 209, Fantasy: 206, 3D Platformer: 198, Anime: 193, Cute: 182, Action: 178, Adventure: 177, Action-Adventure: 168, Colorful: 165, Exploration: 165, Indie: 156, 3D: 148, Singleplayer: 142, Hidden Object: 130, Female Protagonist: 128, Casual: 110, Runner: 99, Third Person: 97, Walking Simulator: 97",game,"Single-player, Steam Achievements, Steam Cloud, Full controller support","0 .. 20,000",308,91,1999,1999,0,1,"English, Japanese, Simplified Chinese, Traditional Chinese",windows,2021/04/13,0,https://nocras.wixsite.com/tasomachi,https://cdn.akamai.steamstatic.com/steam/apps/1015890/header.jpg?t=1649900007
1740010,Undead Menace,"Undead Menace - A brave girl went in search of treasures in ancient caves, despite the legend of the immortal guardians of jewels. She is sure that her passion for treasures cannot be stopped by neither skeletal magicians, nor dangerous chasms and traps!",ASGAME,khukhrovr,Adventure,"2D: 440, Voxel: 436, Isometric: 431, Tactical: 425, Physics: 420, Singleplayer: 407, Adventure: 257, Rogue-like: 226",game,"Single-player, Steam Achievements","200,000 .. 500,000",6,3,399,399,0,0,English,windows,2021/10/29,0,,https://cdn.akamai.steamstatic.com/steam/apps/1740010/header.jpg?t=1635517953
1740380,Pandea Stones,"In the game you play the Pandean hero, Tin, which has a mission to save his planet from alien threat. You will be facing many obstacles thru different environments, where you will meet angry robots and funny looking animals.",MegaWhee,MegaWhee,"Action, Adventure, Indie","Action: 84, Adventure: 78, Cartoon: 61, Aliens: 59, Funny: 57, Futuristic: 55, Magic: 53, Indie: 51, Sci-fi: 31, Science: 29, Superhero: 27, Singleplayer: 25, Comic Book: 23, 2D: 11, 2D Fighter: 11, 2D Platformer: 11, Action-Adventure: 11, Fantasy: 11",game,"Single-player, Partial Controller Support","0 .. 20,000",6,0,199,199,0,0,"English, French, German, Japanese, Korean, Portuguese - Brazil, Russian, Simplified Chinese, Spanish - Latin America, Albanian",windows,2022/08/18,0,http://pandeastones.com/,https://cdn.akamai.steamstatic.com/steam/apps/1740380/header.jpg?t=1661369994
919410,Felix The Reaper,"Felix The Reaper is a challenging and strict 3D puzzle game about bringing humans into deadly situations. You are Felix, the ever-dancing bringer of death, who just so happens to be dangerously in love with Life.",Kong Orange,Daedalic Entertainment,"Adventure, Indie","Adventure: 92, Indie: 90, Puzzle: 39, Logic: 29, Comedy: 27, Dark Humor: 27, Isometric: 27, Funny: 25, Singleplayer: 25, Music: 24, Casual: 23, Great Soundtrack: 23, 3D: 22, Romance: 22, Sokoban: 22, Story Rich: 14, Stealth: 13, Grid-Based Movement: 12, Replay Value: 12, Strategy: 12",game,"Single-player, Steam Achievements, Steam Cloud, Full controller support, Steam Trading Cards, Remote Play on Phone, Remote Play on Tablet, Remote Play on TV","20,000 .. 50,000",273,97,999,999,0,0,"English, German, French, Italian, Spanish - Spain, Portuguese - Brazil, Japanese, Korean, Polish, Russian, Traditional Chinese, Turkish, Simplified Chinese, Danish","windows, mac",2019/10/17,0,https://www.felixthereaper.com/,https://cdn.akamai.steamstatic.com/steam/apps/919410/header.jpg?t=1642454254
1128840,Solitaire Victorian Picnic,All the charms of life in Victorian times! Feel the magic of Victorian England.,Big Up Studio,8floor,Casual,Casual: 21,game,Single-player,"0 .. 20,000",5,3,49,499,90,0,"English, French, German, Russian","windows, mac",2019/08/26,0,https://www.facebook.com/8FloorGames/,https://cdn.akamai.steamstatic.com/steam/apps/1128840/header.jpg?t=1566807732
2053580,Nonozle,A number logic puzzle game. Solve nonograms to form pixel-art images. Features 200 hand-made puzzles.,HopefulToad,HopefulToad,"Casual, Indie","Puzzle: 47, Logic: 41, Casual: 38, Pixel Graphics: 38, Minimalist: 35, Controller: 32, Family Friendly: 26, Relaxing: 24, 2D: 22, Indie: 21, Singleplayer: 20",game,"Single-player, Steam Achievements, Steam Cloud, Full controller support","0 .. 20,000",12,0,399,399,0,3,English,windows,2022/08/12,0,,https://cdn.akamai.steamstatic.com/steam/apps/2053580/header.jpg?t=1662863738
1046060,Dark Romance: Hunchback of Notre-Dame Collector's Edition,Can you save the city from the dangerous criminal Quasimodo?,Domini Games,Big Fish Games,"Adventure, Casual","Adventure: 21, Casual: 21, Hidden Object: 6",game,Single-player,"0 .. 20,000",6,0,999,999,0,1,English,windows,2019/03/9,0,,https://cdn.akamai.steamstatic.com/steam/apps/1046060/header.jpg?t=1552142221
895420,Path of Sin: Greed,"It was supposed to be a simple suicide case – a quick inspection and lots of boring paperwork. But the more you delve into this secluded island and the twisted family relations of the owners, the more complicated and unclear this case becomes.",Cordelia Games,Artifex Mundi,"Adventure, Casual","Casual: 45, Adventure: 44, Hidden Object: 30, Point & Click: 26, Detective: 25, 2D: 24, Female Protagonist: 22, Mystery: 22, Story Rich: 22, Atmospheric: 21",game,"Single-player, Steam Achievements, Steam Cloud, Steam Trading Cards","20,000 .. 50,000",181,25,1499,1499,0,3,"English, French, Italian, German, Japanese, Korean, Polish, Russian, Simplified Chinese","windows, mac, linux",2018/08/30,0,http://www.artifexmundi.com/,https://cdn.akamai.steamstatic.com/steam/apps/895420/header.jpg?t=1579781425
861920,Rocket Valley Tycoon,"Enter the space-race in Rocket Valley Tycoon, a free-to-play resource management game inspired by the golden age of futurism. Build Factories and Railroads, construct Rockets and send the good people of Earth to colonize space.",Rocket Cola Studio,Rocket Cola Studio,"Casual, Free to Play, Indie, Strategy","Free to Play: 30, Casual: 25, Indie: 23, Strategy: 23, Management: 11",game,"Single-player, Steam Trading Cards, In-App Purchases","50,000 .. 100,000",107,66,0,0,0,0,English,windows,2018/06/1,0,http://rocketcolastudio.com/,https://cdn.akamai.steamstatic.com/steam/apps/861920/header.jpg?t=1663949056
779290,Stygian: Reign of the Old Ones,"Delve into a role-playing game of horror, loss and madness set in the strange worlds of HP Lovecraft. Stygian: Reign of the Old Ones offers a mix of rich role-playing and turn-based tactical combat, represented in an illustrative visual style. Can you find salvation in a dead world?",Cultic Games,Fulqrum Publishing,"Indie, RPG","RPG: 147, Indie: 110, Lovecraftian: 105, Horror: 84, Turn-Based Combat: 74, Violent: 54, Atmospheric: 49, Adventure: 45, 2D: 42, Singleplayer: 42, Story Rich: 42, Choices Matter: 36, Philosophical: 33, Sexual Content: 32, Strategy: 31, CRPG: 29, Great Soundtrack: 28, Party-Based RPG: 22, Isometric: 19, 2.5D: 17",game,"Single-player, Steam Achievements, Steam Trading Cards","100,000 .. 200,000",1431,694,1999,1999,0,13,"English, French, German, Spanish - Spain, Russian, Simplified Chinese, Turkish","windows, mac, linux",2019/09/26,0,http://www.stygianthegame.com/,https://cdn.akamai.steamstatic.com/steam/apps/779290/header.jpg?t=1667320499
