App ID,Name,Short Description,Developer,Publisher,Genre,Tags,Type,Categories,Owners,Positive Reviews,Negative Reviews,Price,Initial Price,Discount,CCU,Languages,Platforms,Release Date,Required Age,Website,Header Image
1385700,True Hate,"Die again and again, to start all over again, the taste of victory is sweeter if the path to it is through pain and suffering...",Boom Games Studio,Boom Games Studio,"Action, Adventure, Casual, Indie, Simulation","2D Platformer: 127, Adventure: 118, Hand-drawn: 115, Colorful: 113, Character Action Game: 108, Atmospheric: 101, Action: 97, Indie: 95, Casual: 93, Simulation: 86, Souls-like: 79, Platformer: 72, Nature: 62, Story Rich: 55, Perma Death: 54, Comedy: 46, Linear: 45, Singleplayer: 37, 2D: 29, Precision Platformer: 28",game,"Single-player, Steam Achievements","0 .. 20,000",34,10,799,799,0,0,"English, French, Italian, German, Traditional Chinese, Russian",windows,2020/10/2,0,http://truehate.tilda.ws,https://cdn.akamai.steamstatic.com/steam/apps/1385700/header.jpg?t=1643538430
915140,Adera,"Jane Sinclaire faces her greatest challenge in the mysterious city of Adera. Solve puzzles, collect artifacts, and unlock its secrets!",HitPoint Inc.,HitPoint Inc.,Adventure,"Adventure: 25, Hidden Object: 12, Point & Click: 5, Puzzle: 5",game,"Single-player, Steam Achievements, Steam Cloud","20,000 .. 50,000",134,15,0,0,0,0,"English, French, Italian, German, Spanish - Spain, Portuguese - Brazil, Russian, Traditional Chinese",windows,2018/08/27,0,http://www.hitpointstudios.com/games/adera/,https://cdn.akamai.steamstatic.com/steam/apps/915140/header.jpg?t=1635514344
427270,Orcs Must Die! Unchained,"Orcs Must Die! Unchained takes the award-winning Orcs Must Die! action tower defense game to a whole new level with team-based gameplay! Bust skulls with your best pals in PvE co-op Survival, or put your teamwork to the real test in Sabotage Mode!",Robot Entertainment,Robot Entertainment,"Action, Free to Play, Strategy","Free to Play: 419, Tower Defense: 195, Multiplayer: 192, Co-op: 176, Action: 173, Strategy: 161, MOBA: 99, PvE: 92, Survival: 82, Fantasy: 75, Singleplayer: 70, Third Person: 57, PvP: 54, RPG: 51, Adventure: 46, Funny: 46, Massively Multiplayer: 36, Online Co-Op: 36, FPS: 26, Open World: 22",game,"Multi-player, Single-player, Co-op, Partial Controller Support, Steam Achievements, In-App Purchases","1,000,000 .. 2,000,000",4196,1939,0,0,0,1,"English, French, German, Spanish - Spain, Russian",windows,2017/04/19,0,https://robotentertainment.com/omdu-details,https://cdn.akamai.steamstatic.com/steam/apps/427270/header.jpg?t=1623173206
749580,All That Remains,All That Remains is a 90's inspired eerily atmospheric adventure narrative that lets you experience one man’s life as he comes to terms with his final moments on an abandoned Earth.,Elysian Games,Elysian Games,"Adventure, Casual, Indie","Adventure: 23, Casual: 21, Indie: 21, Walking Simulator: 5",game,"Single-player, Captions available","0 .. 20,000",14,20,399,399,0,0,English,windows,2017/11/10,0,http://www.allthatremainsgame.com/,https://cdn.akamai.steamstatic.com/steam/apps/749580/header.jpg?t=1510477684
1847020,Jet Fighters with Friends  (Multiplayer),Single Player OR Multiplayer Jet Fighter Game with OR without A.I. Bots.,Archor Wright,Archor Games,Simulation,"Simulation: 71, Action: 46, Racing: 42, Arcade: 41, Shooter: 37, Bullet Hell: 30, Combat Racing: 28, Flight: 28, 3D: 26, PvP: 23, Co-op: 21, Local Co-Op: 19, Online Co-Op: 17, Multiplayer: 15, Local Multiplayer: 13",game,"Multi-player, Single-player, Co-op, Online PvP, Online Co-op, LAN PvP, LAN Co-op, PvP","0 .. 20,000",6,1,99,99,0,0,English,windows,2021/12/29,0,http://store.steampowered.com/search/?publisher=Archor%20Games,https://cdn.akamai.steamstatic.com/steam/apps/1847020/header.jpg?t=1667506836
849140,Midnight Caravan,"Midnight Caravan, a richly illustrated choose-your-own-adventure with an unique narrative arc set in an age renowned for its shadiness, where nothing is only what it appears to be.",Gamera Interactive,Gamera Interactive,"Adventure, Indie, RPG","Adventure: 32, Indie: 32, RPG: 30, Nudity: 23, Sexual Content: 22, Gore: 21, Violent: 21, Visual Novel: 19, Story Rich: 10, Choose Your Own Adventure: 6",game,"Single-player, Steam Achievements, Steam Cloud","0 .. 20,000",11,3,999,999,0,0,English,windows,2021/06/25,0,http://www.gamerainteractive.it,https://cdn.akamai.steamstatic.com/steam/apps/849140/header.jpg?t=1624625877
1716230,Holiday Jigsaw Halloween,Halloween adventure waits you in Holiday Jigsaw!,Creobit,8floor,Casual,"Casual: 31, Adventure: 11, Indie: 11, Puzzle: 11, Singleplayer: 11",game,Single-player,"0 .. 20,000",1,0,499,499,0,0,"English, French, German, Russian",windows,2021/09/8,0,https://www.facebook.com/8FloorGames/,https://cdn.akamai.steamstatic.com/steam/apps/1716230/header.jpg?t=1631162650
1464320,Callparin 2,Callparin 2 offers a varied open world. All shops can be entered and the island fully explored. You can buy almost anything here with money. It is up to the player how the money is made. The goal is to do what you feel like doing.,Marco Games,Hoi 4 Deu,"Action, Adventure, Indie, Racing, Simulation","Open World: 260, Exploration: 255, Walking Simulator: 252, Female Protagonist: 247, Relaxing: 243, Nudity: 236, Gambling: 233, Third Person: 229, Indie: 225, Colorful: 222, Underwater: 220, Hidden Object: 217, Capitalism: 212, Trading: 206, Nature: 199, Physics: 196, Realistic: 194, Atmospheric: 190, Lore-Rich: 179, Simulation: 171",game,"Single-player, Steam Achievements","0 .. 20,000",8,10,1999,1999,0,0,"English, German",windows,2021/08/3,0,https://www.marco-games.de,https://cdn.akamai.steamstatic.com/steam/apps/1464320/header.jpg?t=1667059534
500790,Moribund,Local multiplayer mayhem for 2 to 4 players in a post apocalyptic setting. Invite your friends and straight up murder them. In the game. Not in real life...,Traptics,Traptics,"Action, Indie","Action: 42, Indie: 41, 4 Player Local: 26, Gore: 23, Platformer: 23, Post-apocalyptic: 23, 2D: 22, Local Multiplayer: 22, Fighting: 21, Physics: 21, Shooter: 21, Controller: 20, Funny: 20, Early Access: 11",game,"Multi-player, Single-player, Steam Achievements, Shared/Split Screen, Full controller support, Steam Trading Cards, Shared/Split Screen PvP, Remote Play Together, PvP","0 .. 20,000",18,1,999,999,0,0,English,"windows, mac, linux",2017/03/16,0,http://www.traptics.com/,https://cdn.akamai.steamstatic.com/steam/apps/500790/header.jpg?t=1525845271
216910,Of Orcs And Men,"You have been appointed to fulfill an extremely dangerous mission, deep in enemy territory: to kill one man... the Emperor himself. Lead the revolution of the Orcs and Goblins!","Cyanide Studio, Spiders","Cyanide Studio, Nacon","Action, RPG","RPG: 111, Action: 78, Fantasy: 62, Story Rich: 40, Singleplayer: 39, Third Person: 39, Stealth: 24, Adventure: 21, Dark Fantasy: 19, Strategy: 18, Controller: 13, Great Soundtrack: 10, Turn-Based: 7, Difficult: 6",game,"Single-player, Steam Achievements, Steam Cloud, Full controller support","200,000 .. 500,000",1240,451,1499,1499,0,7,"English, German, French, Italian, Spanish - Spain, Russian, Polish, Portuguese - Brazil",windows,2012/10/11,0,http://oforcsandmen.com/,https://cdn.akamai.steamstatic.com/steam/apps/216910/header.jpg?t=1592387063
972280,Deep Space Shooter,Again you are alone against the hordes of hostile spacecrafts where you can only rely on yourself. It is the victory or the death!,Altair Game,ValkyrieInitiative,"Action, Indie","Action: 76, Indie: 68, Space: 53, Bullet Hell: 49, Space Sim: 45, Retro: 41, Arcade: 39, Shooter: 38, ""Shoot Em Up"": 34, 2D: 32, Pixel Graphics: 30, 1980s: 28, Atmospheric: 26, Score Attack: 24, Singleplayer: 22",game,"Single-player, Steam Achievements","50,000 .. 100,000",16,5,199,199,0,0,English,windows,2018/11/15,0,,https://cdn.akamai.steamstatic.com/steam/apps/972280/header.jpg?t=1649945114
348000,Datswer,"Datswer - help a brave hero escape to freedom from the dark dungeon full of traps, horrible enemies and various obstacles. The protagonist of this Android game is a statue that came to life after being hit by a few drops of mysterious magical liquid. You need to use your reflexes and logic to pave a safe way through dark dungeons.",Behtam Developer,"Behtam Developer, UK VENUS","Action, Adventure, Indie","Action: 22, Adventure: 21, Indie: 21, Platformer: 5",game,Single-player,"0 .. 20,000",2,8,399,399,0,0,English,windows,2015/02/4,0,http://www.datswer.com,https://cdn.akamai.steamstatic.com/steam/apps/348000/header.jpg?t=1447368582
516250,Skynet Rising : Portal to the Past,"Isaac spent most of his life serving under the vicious mutant rebel leader, Commander Crugo. Upon discovering a digital weapon of mass destruction, Isaac fears for humanity and flees with his wife and brother to keep the intel from falling into Crugo's hands. Seeking revenge for the betrayal, Crugo hunts down Isaac and destroys his life.",Imran Arafat,Reality Gameware,"Action, Adventure, Indie, Early Access","Action: 37, Early Access: 33, Adventure: 32, Indie: 30, FPS: 18, Zombies: 15, Exploration: 13, First-Person: 13, Gun Customization: 13, Shooter: 13, Blood: 12, Open World: 12, Sandbox: 12, Singleplayer: 12",game,"Single-player, Partial Controller Support","0 .. 20,000",10,16,1499,1499,0,0,"English, French, Italian, German, Spanish - Spain, Arabic, Bulgarian, Czech, Danish, Dutch, Finnish, Greek, Hungarian, Japanese, Korean, Norwegian, Polish, Portuguese - Portugal, Portuguese - Brazil, Romanian, Russian, Simplified Chinese, Swedish, Thai, Traditional Chinese, Turkish, Ukrainian",windows,2016/10/14,0,http://www.gameware.studio,https://cdn.akamai.steamstatic.com/steam/apps/516250/header.jpg?t=1541730199
1974220,Eden Island,"Eden Island is a beautiful survival game. As a survivor, you will explore and survive on a realistic tropical island, craft weapons against beasts, farm and hunt, build your own home.",SnowBaby Games,SnowBaby Games,"Action, Adventure, Casual, Indie, Massively Multiplayer, RPG, Simulation, Early Access","Open World Survival Craft: 557, Survival: 552, Base-Building: 547, Hunting: 543, Mining: 538, Agriculture: 528, Building: 526, Crafting: 525, Archery: 516, Open World: 514, Sandbox: 506, Exploration: 501, Casual: 497, Adventure: 488, Action: 476, Simulation: 468, RPG: 464, Early Access: 463, Indie: 451, Online Co-Op: 442",game,"Multi-player, Single-player, Co-op, Steam Cloud, Online Co-op","0 .. 20,000",34,15,1499,1499,0,13,"English, Simplified Chinese, Traditional Chinese, German, Spanish - Spain, French, Russian, Polish, Portuguese - Brazil, Japanese, Portuguese - Portugal, Korean",windows,2022/10/1,0,,https://cdn.akamai.steamstatic.com/steam/apps/1974220/header.jpg?t=1667743832
1874680,Tower Words,"Word game that mixes tetris, categories game and word search.",Company Not Found,Company Not Found,"Casual, Indie","Word Game: 101, Education: 95, Typing: 91, Time Management: 88, Score Attack: 82, Spelling: 72, Text-Based: 67, Puzzle: 65, Casual: 62, Family Friendly: 59, Minimalist: 50, Indie: 48, Singleplayer: 27",game,"Single-player, Steam Achievements, Steam Cloud, Steam Leaderboards","0 .. 20,000",15,4,149,199,25,0,English,"windows, linux",2022/04/7,0,,https://cdn.akamai.steamstatic.com/steam/apps/1874680/header.jpg?t=1666896306
778760,The Agency: Chapter 2,"After experiencing engine problems on board Commodore Ashemont’s flagship “The Orion”, our team of cunning detectives have been forced to land near the affluent town of Pera, a playground for the Empire’s nobility.",Sapphire Dragon Productions,Sapphire Dragon Productions,"Adventure, Casual, Simulation","Adventure: 31, Visual Novel: 24, Detective: 22, Casual: 21, Great Soundtrack: 21, Mystery: 21, Simulation: 21, Story Rich: 21, Hidden Object: 18, Anime: 14, Puzzle: 11",game,"Single-player, Steam Achievements","0 .. 20,000",9,6,249,499,50,0,English,"windows, mac",2018/03/8,0,,https://cdn.akamai.steamstatic.com/steam/apps/778760/header.jpg?t=1530019592
1757950,回家 - Homeward,"&quot;回家 - Homeward&quot; a relaxing puzzle game, Follow a team of Leopard Cat, black bears and monkeys, native to Taiwan, as they lead you on an adventure from the city to the mountains, exploring Taiwan together and bringing back scenes you may have seen before in your memory.","CHEERFUL CYAN CO., LTD.","CHEERFUL CYAN CO., LTD.","Adventure, Casual, Indie","Indie: 102, Singleplayer: 96, Family Friendly: 93, Cats: 89, Puzzle: 84, Point & Click: 75, 2D: 73, Cute: 71, Casual: 67, Colorful: 63, Hand-drawn: 56, Adventure: 47",game,"Single-player, Steam Achievements, Steam Cloud","0 .. 20,000",13,0,799,799,0,1,"English, Japanese, Simplified Chinese, Traditional Chinese, Korean, Thai","windows, mac",2022/02/22,0,https://www.cheerfulcyan.com/,https://cdn.akamai.steamstatic.com/steam/apps/1757950/header.jpg?t=1652942157
33520,Tropico Reloaded,TROPICO RELOADED is the ultimate game compilation for hobby-dictators and those dreaming of their own Caribbean island. Tropico combines real-time strategy and simulation elements with a healthy dose of political intrigue and Caribbean flair to create a unique and critically acclaimed game experience.,"PopTop Software, BreakAway Games, Frog City Software",Kalypso Media Digital,"Simulation, Strategy","Simulation: 86, City Builder: 84, Strategy: 72, Management: 47, Classic: 32, Sandbox: 31, Great Soundtrack: 27, Singleplayer: 27, Comedy: 26, Pirates: 26, Economy: 12, RTS: 5",game,Single-player,"200,000 .. 500,000",650,85,699,699,0,14,English,windows,2009/07/24,0,http://www.kalypsomedia.com/,https://cdn.akamai.steamstatic.com/steam/apps/33520/header.jpg?t=1668002104
1835790,Neon Horizon: Eclipse,Neon Horizon: Eclipse is a first-person action platformer in which you have to go on an exciting adventure across eight different islands. Each island has its own unique traps and obstacles.,A13,A13,"Action, Adventure, Indie","Action: 268, Adventure: 260, Platformer: 257, Zombies: 251, Runner: 244, Shooter: 234, Action-Adventure: 229, Stylized: 228, Futuristic: 226, Atmospheric: 223, 3D Platformer: 217, Puzzle-Platformer: 209, FPS: 207, Gambling: 201, Colorful: 198, 3D: 196, Dystopian : 192, Survival: 189, First-Person: 186, Score Attack: 184",game,Single-player,"20,000 .. 50,000",6,0,699,699,0,0,"English, Russian, Spanish - Spain",windows,2021/12/21,0,,https://cdn.akamai.steamstatic.com/steam/apps/1835790/header.jpg?t=1640098794
1213450,Craftica,"Craftica is an elegant block-based sandbox game with ultra high degrees of freedom for creative building. Here you can build smooth and beautiful architectures, or construct advanced devices and machineries such as computers, vehicles and robots. Try it out and start exploring your imaginations!",NeoVoxel Studio,NeoVoxel Studio,"Casual, Indie, Simulation, Early Access","Building: 145, Simulation: 139, Physics: 136, Crafting: 133, Automation: 130, Mechs: 124, Robots: 122, Automobile Sim: 120, Survival: 117, City Builder: 111, Programming: 106, Voxel: 103, Sandbox: 98, Open World: 95, Casual: 92, First-Person: 87, Third Person: 81, 3D: 70, Indie: 66, Early Access: 53",game,Single-player,"0 .. 20,000",6,1,699,699,0,0,"English, Simplified Chinese, Traditional Chinese","windows, mac, linux",2020/03/26,0,http://craftica.net,https://cdn.akamai.steamstatic.com/steam/apps/1213450/header.jpg?t=1664547537
571520,Kalaban,Horror-themed action-adventure set in alternate history Finland.,"Rayhouse Productions, GameRealmMadness",GameRealmMadness,"Action, Adventure, Indie","Adventure: 301, Hand-drawn: 296, Dark Comedy: 292, Choose Your Own Adventure: 288, Top-Down Shooter: 286, Horror: 280, Survival Horror: 277, Action: 272, Action-Adventure: 264, Lovecraftian: 256, Survival: 246, 2D: 243, Top-Down: 242, Retro: 230, Open World: 222, Point & Click: 216, Exploration: 208, Cartoony: 205, Colorful: 190, Immersive Sim: 185",game,"Single-player, Steam Achievements, Steam Trading Cards","0 .. 20,000",38,31,499,499,0,1,English,windows,2016/12/29,0,https://gamerealmmadness.blogspot.com/,https://cdn.akamai.steamstatic.com/steam/apps/571520/header.jpg?t=1613119362
890820,Valor Time,Game ‘Valor Time’ representative of the client family Session based multiplayer action RPG (session multiplayer role-playing games) of the medieval WASD non-target management system. The game process supports massive battles.,ObjectOnIT,ObjectOnIT,"Action, Free to Play, Massively Multiplayer, RPG","RPG: 38, Free to Play: 37, Massively Multiplayer: 36, Action: 35, Medieval: 9",game,"Multi-player, Co-op, MMO, In-App Purchases, Online PvP, Online Co-op, PvP","20,000 .. 50,000",74,97,0,0,0,1,"English, Russian",windows,2018/11/14,0,,https://cdn.akamai.steamstatic.com/steam/apps/890820/header.jpg?t=1635981908
467470,Shoot Shoot Mega Pack,"Shoot Shoot Mega Pack is a minimalist party game/2D shooter for up to four players. You can choose a preset game, create your own rulesets, or let the game do it for you. However you decided to play, just make sure you do it with friends!",Actual Humans,Actual Humans,"Action, Casual, Indie","Arena Shooter: 193, Top-Down Shooter: 187, PvP: 184, Competitive: 180, Shooter: 176, Arcade: 169, 2D: 167, Funny: 165, Controller: 162, Top-Down: 159, Action: 154, Minimalist: 144, Family Friendly: 135, Abstract: 133, Casual: 131, Colorful: 124, Comedy: 118, Adventure: 112, Combat: 94, 4 Player Local: 92",game,"Multi-player, Steam Achievements, Shared/Split Screen, Full controller support, Steam Trading Cards, Shared/Split Screen PvP, Remote Play Together, PvP","0 .. 20,000",17,0,1499,1499,0,0,English,"windows, mac",2017/04/28,0,http://ssmpgame.com,https://cdn.akamai.steamstatic.com/steam/apps/467470/header.jpg?t=1493413062
1269940,Dawn at my Neighbourhood,"Dawn at my Neighborhood is a tribute to classic 90s games, reworked with new mechanics and graphics inspired by N64 and PlayStation.",Anti-Gravity Bunny,Anti-Gravity Bunny,"Action, Adventure, Casual, Indie, Early Access","Action: 158, Casual: 152, Indie: 149, Adventure: 147, Early Access: 80, Metroidvania: 74, Horror: 72, Local Co-Op: 69, Action-Adventure: 66, Exploration: 64, Stylized: 62, Top-Down: 61, Retro: 58, ""1990s"": 57, Alternate History: 54, Old School: 52, Co-op: 51, Local Multiplayer: 48, Comedy: 46, Story Rich: 44",game,"Multi-player, Single-player, Co-op, Steam Achievements, Shared/Split Screen, Full controller support, Shared/Split Screen PvP, Shared/Split Screen Co-op, Remote Play Together, PvP","0 .. 20,000",15,1,0,0,0,0,English,windows,2020/09/25,0,https://www.instagram.com/antigravbunny,https://cdn.akamai.steamstatic.com/steam/apps/1269940/header.jpg?t=1607979071
273590,Descent 3,"The vertigo continues as the highly anticipated sequel to Descent I and II takes the mind-bending, pulse-pounding experience to another level!",Outrage Entertainment,Interplay Inc.,Action,"Action: 51, 6DOF: 24, FPS: 18, Classic: 17, Sci-fi: 17, Shooter: 12, Old School: 6, Space: 6, Retro: 5",game,"Multi-player, Single-player","50,000 .. 100,000",53,25,999,999,0,0,English,"windows, mac, linux",2014/04/15,0,http://www.interplay.com/games/descent.php,https://cdn.akamai.steamstatic.com/steam/apps/273590/header.jpg?t=1667254605
1755470,Memory Booster,"Memory Booster – is a incremental puzzle game. Memorize tiles, upgrade stats to progress easier and train your brain!",Luci Entertainment,Luci Entertainment,"Casual, Indie","Casual: 49, Education: 49, Puzzle: 43, Board Game: 39, Point & Click: 37, 2D: 35, Minimalist: 26, Pixel Graphics: 24, Family Friendly: 22, Indie: 21, Score Attack: 20, Singleplayer: 17, Resource Management: 16",game,"Single-player, Steam Achievements","0 .. 20,000",23,5,199,199,0,0,English,windows,2021/09/30,0,,https://cdn.akamai.steamstatic.com/steam/apps/1755470/header.jpg?t=1666125336
664440,Cognizant Protocol,"Cognizant Protocol, a text based adventure game that brings player into the struggle of Aldis Farrell, an AI scientist who is unable to free himself from his emergency pod buried under crash landed space station.",Nilem Studio,Nilem Studio,"Adventure, Indie, Simulation","Adventure: 21, Indie: 21, Simulation: 21",game,Single-player,"0 .. 20,000",5,0,299,299,0,0,English,windows,2017/07/22,0,http://nilemstudio.com/,https://cdn.akamai.steamstatic.com/steam/apps/664440/header.jpg?t=1501255069
290440,QUALIA 3: Multi Agent,"Qualia 3 is a 2D shoot-’em-up game that brings a few unique elements to the classic genre. In the unknown expanse of the deep sea, survival of the fittest is taken to a whole new level. The weak and slow perish while the strong survive.","Shindenken, EXTREME","Komodo, MASAYA GAMES","Action, Indie","Action: 50, Indie: 47, ""Shoot Em Up"": 6",game,"Single-player, Steam Achievements, Steam Cloud, Full controller support","20,000 .. 50,000",22,26,499,499,0,0,"English, Japanese",windows,2014/04/18,0,http://qualia.degica.com/,https://cdn.akamai.steamstatic.com/steam/apps/290440/header.jpg?t=1657780440
628710,Hell Warders,"Face the gates of Hell in a fusion of third-person action, RPG and Tower Defence. Repel the demons alone or in co-op by building defences. Upgrade powerful units to help you in battle, before jumping into the fight yourself, with an arsenal of skills and weapons to rip apart the oncoming swarm.",Anti Gravity Game Studios,PQube,"Action, Adventure, Casual, Indie, RPG, Strategy","Action: 209, Strategy: 202, RPG: 199, Casual: 194, Adventure: 190, Tower Defense: 186, Co-op: 181, Early Access: 178, Online Co-Op: 178, Multiplayer: 176, Dark Fantasy: 171, Action RPG: 167, Fantasy: 165, Demons: 158, Walking Simulator: 148, Souls-like: 141, 3D: 136, Swordplay: 124, Family Friendly: 102, Linear: 90",game,"Multi-player, Single-player, Co-op, Steam Achievements, Steam Cloud, Full controller support, Steam Trading Cards, Online PvP, Online Co-op, Remote Play on TV, PvP","0 .. 20,000",81,52,1499,1499,0,0,"English, French, Italian, German, Spanish - Spain, Japanese, Korean, Portuguese - Brazil, Russian, Simplified Chinese, Traditional Chinese",windows,2019/02/21,0,http://hellwarders.com,https://cdn.akamai.steamstatic.com/steam/apps/628710/header.jpg?t=1644408920
703200,Jumphobia Classic,"Are you ready for the ultimate puzzle platforming challenge? There is no jump button, instead you automatically jump when you run off a ledge! You are going to need both skill and intelligence if you hope to beat this game!",Wix Games,Displacement Studios,"Action, Casual, Indie","Precision Platformer: 97, 2D Platformer: 91, Puzzle-Platformer: 88, Puzzle: 85, Difficult: 82, Platformer: 77, Arcade: 75, 2D: 72, Linear: 70, Action: 69, Casual: 66, Minimalist: 64, Family Friendly: 62, Logic: 60, Level Editor: 58, Physics: 56, Singleplayer: 55, 8-bit Music: 52, Stylized: 50, Indie: 48",game,"Single-player, Includes level editor","0 .. 20,000",5,3,299,299,0,0,English,"windows, mac",2017/09/4,0,http://www.wixgames.co.uk/jumphobiaxl.html,https://cdn.akamai.steamstatic.com/steam/apps/703200/header.jpg?t=1648561621
1210260,Purgatory Overkill,&quot;Purgatory Overkill&quot; is a VR shooter and a VR tower defense when you can build turrets and walls to help you fight endless hordes of monsters while you actively participate in the fight with loads of guns.,Death On Sausage,"Scalable Graphics USA, INC","Action, Early Access","Early Access: 477, Exploration: 433, FPS: 427, Tower Defense: 425, Shooter: 422, 3D: 418, Horror: 412, Base-Building: 408, VR: 406, Action: 400, Realistic: 396, Fantasy: 388, Space: 381, Sci-fi: 376, Gothic: 367, Dark Fantasy: 363, Demons: 360, Survival: 358, Aliens: 355, Futuristic: 351",game,"Single-player, Stats, Steam Achievements, Steam Cloud, Steam Leaderboards","50,000 .. 100,000",1,1,999,999,0,0,"English, French",windows,2021/04/26,0,https://www.purgatoryoverkill.com/,https://cdn.akamai.steamstatic.com/steam/apps/1210260/header.jpg?t=1632822928
1439070,Stranded B,"Slip into the role of a refugee prisoner who has a boat accident while on the run and is stranded on an island. Craft your tools and weapons, collect whatever you can find, and build your own home. Discover, build, hunt, craft, loot, survive!",S GameTime,S GameTime,"Action, Adventure, Indie, Simulation","Survival: 256, 3D: 251, Singleplayer: 247, Adventure: 243, Atmospheric: 241, Hunting: 232, Open World Survival Craft: 232, Third Person: 226, Sandbox: 220, Exploration: 218, Crafting: 216, Loot: 210, Nature: 206, Relaxing: 196, Character Customization: 192, Zombies: 190, Colorful: 188, Action: 185, Building: 179, Simulation: 174",game,Single-player,"0 .. 20,000",9,6,2499,2499,0,0,"English, German",windows,2022/10/27,0,https://sgametime.com/games/stranded-b-game/,https://cdn.akamai.steamstatic.com/steam/apps/1439070/header.jpg?t=1666898843
858560,Tet VR,"Tet VR is a fast paced, puzzle game designed for VR touch. With multiple game types to pick from you choose how casual or hectic to make the game. Tet VR is a puzzle game that's made accessible and intuitive for all ages.",In Your Head Games LLC,In Your Head Games LLC,"Casual, Indie","Casual: 31, Indie: 31, VR: 5",game,"Multi-player, Single-player, Co-op, Online PvP, Online Co-op, PvP","0 .. 20,000",0,1,499,499,0,0,"English, French, German, Spanish - Spain, Portuguese - Portugal",windows,2021/06/2,0,https://www.reddit.com/r/InYourHeadGames/,https://cdn.akamai.steamstatic.com/steam/apps/858560/header.jpg?t=1622676087
