App ID,Name,Short Description,Developer,Publisher,Genre,Tags,Type,Categories,Owners,Positive Reviews,Negative Reviews,Price,Initial Price,Discount,CCU,Languages,Platforms,Release Date,Required Age,Website,Header Image
393150,The Dreamatorium of Dr. Magnus 2,"The Dreamatorium of Dr. Magnus 2 is the second chapter of the game you loved. Colorful locations, challenging puzzles, RPG elements, amusing comments and many more to come!",Two Desperados,Two Desperados,"Adventure, Casual","Casual: 35, Adventure: 31, Hidden Object: 18, Puzzle: 13",game,"Single-player, Steam Achievements, Steam Cloud, Steam Trading Cards","20,000 .. 50,000",58,21,799,799,0,0,"English, French, Italian, German, Spanish - Spain, Dutch, Japanese, Korean, Polish, Portuguese - Brazil, Russian, Simplified Chinese","windows, mac, linux",2015/09/9,0,http://twodesperados.com/games/dreamatorim-of-dr-magnus-2/,https://cdn.akamai.steamstatic.com/steam/apps/393150/header.jpg?t=1478088745
347030,The Bluecoats: North vs South (2012),1861. The Civil War has been declared in the United States. Two clans are fighting: The abolitionist Union and the pro-slavery Confederates. NORTH vs SOUTH is inspired from THE BLUE COATS comic book. You'll relive the biggest events of this battle with Sergeant Chesterfield and Corporal Butch.,Little World Studio,Microïds,"Action, Strategy","Action: 33, Strategy: 33, Casual: 5, Remake: 5",game,"Multi-player, Single-player, Shared/Split Screen, Steam Trading Cards, Remote Play Together","200,000 .. 500,000",153,177,0,0,0,0,"English, French, Italian, German, Spanish - Spain, Dutch, Japanese, Korean, Polish, Portuguese - Brazil, Russian, Simplified Chinese, Swedish","windows, mac",2015/02/2,0,,https://cdn.akamai.steamstatic.com/steam/apps/347030/header.jpg?t=1599038577
1118850,Lock; In - Final Cut,It doesn't matter WHY you're here.,GoldSymbol Games,GoldSymbol Games,Indie,"Casual: 43, Point & Click: 36, Puzzle: 34, Pixel Graphics: 31, Atmospheric: 28, Singleplayer: 22, Indie: 21",game,"Single-player, Steam Achievements","0 .. 20,000",1,0,499,499,0,0,English,windows,2022/06/3,0,,https://cdn.akamai.steamstatic.com/steam/apps/1118850/header.jpg?t=1654258791
1933490,Let's Play! Oink Games,"Selling over 1,000,000 copies worldwide, the continually growing game maker, Oink Games, has brought their works to Steam! Play many popular board games in a variety of ways with your family, friends, or even solo!",Oink Games Inc.,Oink Games Inc.,Casual,"Casual: 67, Board Game: 54, Multiplayer: 44, Local Multiplayer: 42, Turn-Based Tactics: 38, Real Time Tactics: 32, PvP: 30, Tabletop: 28, 3D: 26, Controller: 24, Family Friendly: 24, Online Co-Op: 21, Singleplayer: 18, Local Co-Op: 17, Co-op: 14, 4 Player Local: 13, Card Game: 11",game,"Multi-player, Single-player, Co-op, Steam Achievements, Steam Cloud, Shared/Split Screen, Cross-Platform Multiplayer, Full controller support, Online PvP, Shared/Split Screen PvP, Online Co-op, Shared/Split Screen Co-op, Remote Play on Phone, Remote Play on Tablet, Remote Play on TV, Remote Play Together, PvP","0 .. 20,000",17,8,2499,2499,0,3,"English, French, Italian, German, Spanish - Spain, Portuguese - Portugal, Simplified Chinese, Traditional Chinese, Japanese, Korean",windows,2022/07/6,0,https://oinkgames.com/en/games/digital/lets-play-oink-games/,https://cdn.akamai.steamstatic.com/steam/apps/1933490/header.jpg?t=1667192978
1177610,Katana Kata,Indie souls-like with innovative fight system where you practice your Katana on the path for endless improvement; again and again.,"Stas Shostak, Alexander Sitnikov",Stas Shostak,"Action, Indie, Early Access","Action: 58, Violent: 56, Indie: 54, Early Access: 53, Swordplay: 43, Historical: 36, Atmospheric: 35, Fighting: 35, Rogue-lite: 35, Singleplayer: 35, Blood: 34, Gore: 34, Hack and Slash: 33, Realistic: 33, Rogue-like: 31, Souls-like: 30, Colorful: 24, Difficult: 24, Simulation: 22, Adventure: 13",game,"Single-player, Partial Controller Support, Steam Achievements, Steam Leaderboards","0 .. 20,000",45,19,1499,1499,0,0,"English, Russian, Ukrainian, Simplified Chinese",windows,2020/01/28,0,,https://cdn.akamai.steamstatic.com/steam/apps/1177610/header.jpg?t=1585925798
1099500,The Curious Tale of the Stolen Pets,"Help your grandfather solve the mystery of the stolen pets by solving puzzles in wonderful miniature worlds crafted for VR. Use a hairdryer to melt snow in a wintery landscape! Search the wreck of a pirate ship hidden under the surface! Every world is unique, full of interactions and colorful life.",Fast Travel Games,Fast Travel Games,"Adventure, Casual, Indie","Adventure: 68, Casual: 67, Indie: 67, Puzzle: 14, VR: 12, VR Only: 1",game,"Single-player, Steam Achievements","0 .. 20,000",200,18,999,999,0,1,"English, French, Italian, German, Spanish - Spain, Simplified Chinese, Japanese, Korean, Portuguese - Brazil, Russian, Spanish - Latin America",windows,2019/11/14,0,https://www.fasttravelgames.com/thecurioustaleofthestolenpets/,https://cdn.akamai.steamstatic.com/steam/apps/1099500/header.jpg?t=1641228732
1736260,Home Designer - Makeover Blast,Help your clients in this match3 game turn their drab living space into fantastic rooms! Solve matching puzzles to design and decorate the perfect home with beautiful furniture!,Mad - Data,HH-Games,Casual,"Casual: 57, Match 3: 44, Puzzle: 34, 2D: 32, Singleplayer: 28",game,Single-player,"0 .. 20,000",11,4,424,499,15,1,English,windows,2021/09/11,0,,https://cdn.akamai.steamstatic.com/steam/apps/1736260/header.jpg?t=1631348313
234270,Ken Follett's The Pillars of the Earth,"12th century, England: In a time of poverty and war, a small town begins the construction of a cathedral to claim wealth and safety for its people. In their struggle to survive, lives and destinies intertwine. Based on Ken Follett's world-bestseller ‘The Pillars of the Earth’.",Daedalic Entertainment,Daedalic Entertainment,"Adventure, Casual, Indie","Adventure: 169, Choices Matter: 161, Point & Click: 151, Visual Novel: 149, Story Rich: 146, Medieval: 144, Indie: 120, Casual: 109, Interactive Fiction: 96, Based On A Novel: 90, Atmospheric: 83, Singleplayer: 82, Historical: 48, Great Soundtrack: 47, Violent: 25, Female Protagonist: 22, Hand-drawn: 19, RPG: 11, 2D: 10, Choose Your Own Adventure: 10",game,"Single-player, Steam Achievements, Steam Cloud, Full controller support, Steam Trading Cards, Remote Play on TV","200,000 .. 500,000",4833,356,199,1999,90,395,"English, French, Italian, German, Spanish - Spain, Polish, Russian, Simplified Chinese, Traditional Chinese, Turkish","windows, mac, linux",2017/08/15,0,http://www.the-pillars-of-the-earth-game.com/,https://cdn.akamai.steamstatic.com/steam/apps/234270/header.jpg?t=1651768738
1912970,Late photographer 3,This is a game of drawing cards and collecting cards.,okyakusama,okyakusama,Casual,"Female Protagonist: 106, Sexual Content: 100, Nudity: 97, Visual Novel: 94, Card Game: 91, Casual: 85, Relaxing: 78, Singleplayer: 70, Dating Sim: 61, Cute: 59, Romance: 57, 2D: 55, Rogue-lite: 45, Story Rich: 43, 2D Platformer: 40, Heist: 29, Point & Click: 25",game,Single-player,"0 .. 20,000",20,9,499,499,0,0,"English, Simplified Chinese",windows,2022/03/3,0,https://space.bilibili.com/1988361363?spm_id_from=333.1007.0.0,https://cdn.akamai.steamstatic.com/steam/apps/1912970/header.jpg?t=1652275904
1271600,Panzer Crew VR,"A multiplayer tank deathmatch game where each tank is manned by three players: the commander, the driver and the gunner. Up to four tanks can battle for a total of 12 players. Can your crew work as a unit or will you devolve into chaos and be annihilated?",Ian David Elder,Ian David Elder,"Action, Indie","Action: 56, Indie: 56, VR: 13, Tanks: 12, Co-op: 11, Multiplayer: 11",game,"Multi-player, Co-op, Online PvP, Online Co-op, PvP","0 .. 20,000",4,2,499,499,0,0,English,windows,2020/07/27,0,,https://cdn.akamai.steamstatic.com/steam/apps/1271600/header.jpg?t=1595835479
594320,Return of Red Riding Hood Enhanced Edition,"This visual novel is a collection of alternative realities. How events would turn out and how they end will depend on your choices. Visit wolf's den and solve his secret, or try to tame the wild beast. Eat a pasty with mushrooms and experience something new, or feed it to the old lady, because it's her favorite filling.",NLB project,NLB project,"Adventure, Casual, Indie","Adventure: 24, Casual: 22, Indie: 22, Visual Novel: 16, Choices Matter: 13, Choose Your Own Adventure: 13, Female Protagonist: 13, Multiple Endings: 13, Narration: 13, Family Friendly: 12, Funny: 12, Interactive Fiction: 12, Mouse only: 12, Nonlinear: 12, Puzzle: 12, Replay Value: 12, Singleplayer: 12, Surreal: 12, Cute: 11, Short: 11",game,"Single-player, Steam Achievements, Steam Cloud, Steam Trading Cards","0 .. 20,000",46,5,299,299,0,114,"English, Russian","windows, mac, linux",2018/01/19,0,https://nlbproject.com/,https://cdn.akamai.steamstatic.com/steam/apps/594320/header.jpg?t=1629829197
1246620,Neon Parasite,"INFEST YOUR FRIENDS! Neon Parasite is a game of chaotic critter combat where you'll be hovering, shooting, and dashing your way around the competition to reign the most infested bug of all. This 4-player local party game boasts crazy strategic battles across a multitude of different arenas.",Louis Protano,Louis Protano,"Action, Indie","2D Fighter: 342, Pixel Graphics: 338, PvP: 334, Local Multiplayer: 329, Aliens: 322, Action: 312, 4 Player Local: 305, Colorful: 297, Party Game: 288, Indie: 287, Psychedelic: 278, Fighting: 254, Platformer: 243, Sci-fi: 230, Local Co-Op: 215, 2D Platformer: 214, 2D: 196, Bullet Hell: 177, Atmospheric: 159, Retro: 139",game,"Multi-player, Single-player, Shared/Split Screen, Full controller support, Shared/Split Screen PvP, Remote Play Together, PvP","0 .. 20,000",4,0,799,799,0,0,English,windows,2020/11/13,0,http://neonparasite.com,https://cdn.akamai.steamstatic.com/steam/apps/1246620/header.jpg?t=1605306779
1374050,KIRO,KIRO is an indie developed horror text adventure game that plays in real time while your player is controlled with text command inputs providing a unique intense experience that combines modern action game play with classic text adventure games.,Blekoh,Blekoh,Adventure,"Adventure: 60, Horror: 50, Text-Based: 43, Dungeon Crawler: 37, Singleplayer: 34, Action-Adventure: 27, Side Scroller: 26, 2D: 24, Pixel Graphics: 23, Dark: 20, Fantasy: 18, Multiple Endings: 16",game,"Single-player, Steam Achievements","0 .. 20,000",11,0,299,299,0,0,English,"windows, linux",2020/10/16,0,,https://cdn.akamai.steamstatic.com/steam/apps/1374050/header.jpg?t=1602838055
357600,Unium,Draw a line. A single line. How complex can that be?,Kittehface Software,Kittehface Software,"Casual, Indie, Strategy","Casual: 31, Indie: 27, Puzzle: 26, Strategy: 23, Minimalist: 10, Singleplayer: 6",game,"Single-player, Includes level editor, Steam Achievements, Steam Cloud, Steam Trading Cards, Steam Workshop","20,000 .. 50,000",283,17,199,199,0,0,"English, French, German, Spanish - Spain, Japanese, Korean, Portuguese - Portugal, Russian, Simplified Chinese","windows, mac, linux",2015/03/27,0,http://www.kittehface.com/p/unium.html,https://cdn.akamai.steamstatic.com/steam/apps/357600/header.jpg?t=1572571260
282780,Stick 'Em Up 2: Paper Adventures,"Stick 'Em Up 2: Paper Adventures is a run'n'gun/platform game of stick figure characters fighting through beautiful paper and card levels. Fly across city rooftops firing rockets from a helicopter, leap between pirate ships with a sword, race buggies on the moon, and more!",Never Don't Play,Never Don't Play,"Action, Adventure, Indie","Action: 39, Adventure: 38, Indie: 37, Side Scroller: 21, Co-op: 19, Platformer: 19, 4 Player Local: 17, Local Multiplayer: 17, 2D: 16, Local Co-Op: 16, Multiplayer: 16, Controller: 13, Singleplayer: 13",game,"Multi-player, Single-player, Co-op, Steam Achievements, Steam Cloud, Shared/Split Screen, Cross-Platform Multiplayer, Full controller support, Remote Play Together","20,000 .. 50,000",84,40,299,299,0,0,English,"windows, mac, linux",2015/07/27,0,http://stickemup2.com/,https://cdn.akamai.steamstatic.com/steam/apps/282780/header.jpg?t=1656356062
817160,Scary defense,"Fight your way through killing clowns, pigs and robbers in several maps across the globe.",WhackAKey Games,Big Black Bear,"Action, Casual, Indie, Strategy","Action: 106, Indie: 100, Strategy: 97, Tower Defense: 95, Colony Sim: 92, Third-Person Shooter: 85, 3D: 82, Psychological Horror: 79, Third Person: 79, Horror: 71, Atmospheric: 62, Combat: 60, Open World: 58, Stealth: 57, Physics: 54, Singleplayer: 52, Casual: 49",game,Single-player,"0 .. 20,000",14,6,99,99,0,0,English,windows,2018/04/24,0,,https://cdn.akamai.steamstatic.com/steam/apps/817160/header.jpg?t=1654375452
2088570,Tiny Rogues,"Tiny Rogues is a challenging fantasy rogue-lite bullet-hell dungeon crawler with rpg elements. Build a new unique character each run and fight one monster-infested room after another! Discover unique weapons, collect magical items and level up to become more and more powerful!",RubyDev,RubyDev,"Action, Adventure, Indie, RPG, Early Access","Action Roguelike: 201, Bullet Hell: 193, Top-Down Shooter: 191, Difficult: 185, Replay Value: 181, Dungeon Crawler: 175, Action-Adventure: 172, Top-Down: 168, Rogue-like: 166, 1980s: 165, Rogue-lite: 164, Adventure: 155, Fantasy: 153, RPG: 141, Singleplayer: 140, Pixel Graphics: 128, Combat: 108, Early Access: 90, 2D: 81, Indie: 69",game,"Single-player, Steam Achievements","50,000 .. 100,000",908,19,599,599,0,810,English,windows,2022/09/23,0,,https://cdn.akamai.steamstatic.com/steam/apps/2088570/header.jpg?t=1664204203
2096040,VIRUSUM,"As a friendly bacteria, you must fight a new dangerous virus in the body.",Orange Blossom,My Way Games,"Action, Adventure, Casual, Indie","Casual: 63, Adventure: 57, Arcade: 34, Flight: 31, Colorful: 28, Singleplayer: 22, Action: 21, Indie: 21",game,Single-player,"0 .. 20,000",1,1,499,499,0,0,"English, Italian, Spanish - Spain, Arabic, Portuguese - Brazil, Vietnamese, Danish, Traditional Chinese, Korean, Norwegian, Portuguese - Portugal, Russian, Turkish, Finnish, Swedish",windows,2022/08/4,0,,https://cdn.akamai.steamstatic.com/steam/apps/2096040/header.jpg?t=1659596572
1167630,Teardown,Prepare the perfect heist in this simulated and fully destructible voxel world. Tear down walls with vehicles or explosives to create shortcuts. Stack objects to reach higher. Use the environment to your advantage in the most creative way you can think of.,Tuxedo Labs,Tuxedo Labs,"Action, Indie, Simulation, Strategy","Destruction: 704, Physics: 624, Sandbox: 599, Voxel: 543, First-Person: 481, Heist: 455, Open World: 443, Singleplayer: 430, Realistic: 416, Simulation: 394, Action: 382, 3D: 371, Puzzle: 368, Driving: 360, Tactical: 348, Indie: 347, Replay Value: 345, Immersive Sim: 338, Puzzle-Platformer: 327, Runner: 308",game,"Single-player, Includes level editor, Steam Achievements, Steam Cloud, Full controller support, Steam Workshop, Remote Play on Tablet","1,000,000 .. 2,000,000",49958,2093,1999,1999,0,2921,English,windows,2022/04/21,0,http://teardowngame.com,https://cdn.akamai.steamstatic.com/steam/apps/1167630/header.jpg?t=1666292775
1439190,Archeologist Simulator,"Like a true explorer, look for all the bones hidden underground to build the dinosaur skeleton.",Archeologists,Archeologists,Adventure,"Adventure: 70, Casual: 45, Simulation: 40, Singleplayer: 38, Cute: 35, Dinosaurs: 31, Family Friendly: 27, Indie: 25, Magic: 23, Nature: 21, Soundtrack: 19, Sports: 17, Underground: 15",game,,"0 .. 20,000",0,11,0,0,0,0,English,windows,2020/12/16,0,,https://cdn.akamai.steamstatic.com/steam/apps/1439190/header.jpg?t=1635369278
1580380,Descent Vector: Space Runner,"Race your space pod through a procedurally generated gauntlet of space stations, asteroids, and debris in this single-player sci-fi endless runner. Test your limits, experience wild crashes, improve your distance, visit unique solar systems and unlock new space pods to pilot.",Heavy Pepper Inc.,Heavy Pepper Inc.,"Action, Adventure, Casual, Indie, Racing, Simulation","Space: 136, Racing: 130, Flight: 127, Runner: 123, Fast-Paced: 120, Difficult: 113, Arcade: 111, Action: 107, Sci-fi: 104, Spaceships: 100, Space Sim: 96, Futuristic: 92, Singleplayer: 88, Controller: 85, Procedural Generation: 83, Character Customization: 80, Third Person: 76, Realistic: 72, 3D: 68, Colorful: 65",game,"Single-player, Steam Achievements, Steam Cloud, Steam Leaderboards, Full controller support","20,000 .. 50,000",10,1,999,999,0,0,English,"windows, mac",2021/08/16,0,https://www.descentvector.com,https://cdn.akamai.steamstatic.com/steam/apps/1580380/header.jpg?t=1667583725
753210,DIY Life,"DIY Simulator is teaching everyone how to build DIY (DO IT YOURSELF) objects like electric skateboards, drones, airplanes, electric bikes, power banks and many more. By having a day and night cycle, you need to sleep because if you get tired, you cannot work.",Silent Parrot Studio SRL,Silent Parrot Studio SRL,"Indie, Simulation, Early Access","Simulation: 32, Indie: 31, Early Access: 30, First-Person: 12, Singleplayer: 11, Adventure: 10, Building: 10, Crafting: 10, Difficult: 10, Education: 10, Exploration: 10, Open World: 10, Puzzle: 10, RPG: 10, Racing: 10, Realistic: 10, Resource Management: 10, Sandbox: 10, Survival: 10",game,Single-player,"0 .. 20,000",13,14,1999,1999,0,0,English,windows,2019/06/7,0,https://diy-simulator.com/,https://cdn.akamai.steamstatic.com/steam/apps/753210/header.jpg?t=1611317676
489760,Demon Truck,"A badass rig drives only for the glory of Satan and races with blistering fury towards the Next Hell in this ARCADE ACTION IMMORTAL TRUCKER!. Skill based gameplay, high scores, demonic fury!",Triger Mountain,Adventurepro Games LLC,"Action, Casual, Indie, Racing","Action: 31, Indie: 31, Casual: 21, Racing: 20, ""Shoot Em Up"": 18, Fast-Paced: 12, Runner: 11",game,"Single-player, Stats, Partial Controller Support, Steam Achievements, Steam Leaderboards","0 .. 20,000",35,7,499,499,0,0,English,"windows, mac, linux",2016/09/26,0,http://www.demontruck.com,https://cdn.akamai.steamstatic.com/steam/apps/489760/header.jpg?t=1475612340
1313880,Test Tube Titans: Taster Trial,"Take on your friends in a chaotic physics-based wrestling match using giant monsters that have been procedurally mutated to be unique every time you play. Or, craft a custom titan and take it for a walk through the neighbourhood, tearing up everything as you go!",Ghost Time Games,Ghost Time Games,Action,"Action: 32, Physics: 13, Destruction: 12, Procedural Generation: 12, Wrestling: 11",game,"Multi-player, Single-player, Co-op, Shared/Split Screen, Full controller support, Shared/Split Screen PvP, Shared/Split Screen Co-op, Remote Play Together, PvP","0 .. 20,000",6,3,0,0,0,0,English,"windows, mac, linux",2020/05/25,0,http://ghosttimegames.com/,https://cdn.akamai.steamstatic.com/steam/apps/1313880/header.jpg?t=1599900805
680640,ChefU,"Built exclusively for VR, ChefU puts you in your dream kitchen where you never have to wash dishes or clean up after yourself. Hone your cooking and knife skills with over 60 items to cook and dozens of cooking tools. Leave the mess for someone else to clean up.",Lockem Reality,Lockem Reality,"Action, Casual, Simulation","Simulation: 25, Casual: 23, Action: 22, VR: 8, Cooking: 7",game,Single-player,"0 .. 20,000",17,44,2999,2999,0,0,English,windows,2017/08/28,0,http://lockemreality.com/chefu.php,https://cdn.akamai.steamstatic.com/steam/apps/680640/header.jpg?t=1507670426
538900,ZIQ,"Run, dodge, jump, pull pickups, switch polarity and die constantly! You get to do all this while being heckled for your constant mistakes! &quot;ZIQ&quot; is an arcade runner that features polarity-switching gameplay. Switch ZIQ's polarity to make it safely past obstacles or in some cases destroy them.",Midnight Sea Studios,3D Realms,Indie,"Indie: 24, Arcade: 5, Runner: 5",game,"Single-player, Steam Achievements, Steam Leaderboards, Full controller support, Steam Trading Cards","0 .. 20,000",12,0,999,999,0,0,English,"windows, mac",2018/08/1,0,http://midnightsea.net/ziq/,https://cdn.akamai.steamstatic.com/steam/apps/538900/header.jpg?t=1667294224
689270,Chessia,"Are you a chess master? Or a chess enthusiast? Maybe you just play chess from time to time. Whoever you are, Chessia is here for you.","Hakki Ozturk, Halil Ibrahim Ozturk",Hakki Ozturk,"Casual, Indie, Sports, Strategy","Tabletop: 25, Casual: 22, Sports: 21, Indie: 20, Strategy: 20, Chess: 17, Board Game: 12",game,"Multi-player, Single-player, Cross-Platform Multiplayer, Online PvP, Shared/Split Screen PvP, Remote Play Together, PvP","0 .. 20,000",3,4,799,799,0,0,English,"windows, linux",2018/09/20,0,,https://cdn.akamai.steamstatic.com/steam/apps/689270/header.jpg?t=1537481326
593620,The Last Conflict,"The Last Conflict is a 2-D multiplayer online action and strategic based game inspired by classic games Resident Evil, Silent Hill, and Zombie Ate my Neighbors, bringing them together to create a fun zombie killing experience.",Darker Emerald,EmmyGames,"Action, Free to Play, Indie, Massively Multiplayer","Free to Play: 43, Zombies: 34, Action: 30, Gore: 30, Indie: 29, Massively Multiplayer: 29, Violent: 29, Survival: 7, Multiplayer: 6, 2D: 5",game,"Multi-player, Single-player, Co-op, Online PvP, Online Co-op, PvP","50,000 .. 100,000",164,60,0,0,0,0,English,windows,2017/09/21,0,http://www.thelastconflict.com/,https://cdn.akamai.steamstatic.com/steam/apps/593620/header.jpg?t=1590792597
702300,Number World Adventure,"Move all tiles and merge similar Numbers when they touch. Brake chains, melt the ice and overcome other obstacles to join the pieces to fulfil tasks on your numerical puzzle adventure in the Number World! Play 120 levels in the quest mode or set the highest score in various Challenge modes.",Notus Games Ltd,Notus Games Ltd,Casual,"Casual: 21, Indie: 11, Puzzle: 11",game,"Single-player, Steam Achievements, Steam Cloud","0 .. 20,000",7,0,499,499,0,0,English,"windows, mac",2017/09/22,0,,https://cdn.akamai.steamstatic.com/steam/apps/702300/header.jpg?t=1506090375
1708610,Pretty Girls Breakout!,"Striking the ball at the right time, breaking blocks and collecting costumes of cute girls with animal features! A battling action-type breakout game that hits, hits, and hits back!",Zoo Corporation,Zoo Corporation,Casual,"Anime: 117, Cute: 111, Casual: 107, Bullet Hell: 102, Action: 101, Arcade: 95, Top-Down Shooter: 92, Female Protagonist: 87, Puzzle: 86, Singleplayer: 85, 2D: 84, Fantasy: 79, Score Attack: 78, Physics: 75, Nudity: 73, Remake: 71, Sexual Content: 69, Mature: 63, Sports: 60, Retro: 56",game,"Single-player, Steam Achievements, Steam Cloud, Steam Leaderboards, Full controller support","0 .. 20,000",16,4,599,599,0,0,"English, Simplified Chinese, Traditional Chinese, Japanese, Spanish - Latin America",windows,2021/09/28,0,https://game.zoo.jp/,https://cdn.akamai.steamstatic.com/steam/apps/1708610/header.jpg?t=1663047032
203830,The Dark Eye: Chains of Satinav,"Face your Destiny! In Andergast, whose inhabitants are considered to be superstitious, King Efferdan awaits a state visit from high-ranking dignitaries. For centuries the kingdom has been at odds with neighboring Nostria, but now first steps are being undertaken toward a lasting peace.",Daedalic Entertainment,Daedalic Entertainment,"Adventure, Indie","Adventure: 122, Point & Click: 106, Fantasy: 43, Singleplayer: 43, Puzzle: 41, Story Rich: 37, Indie: 26, Escape Room: 17, Great Soundtrack: 15, 2D: 12, Retro: 11, Cult Classic: 10, Hand-drawn: 10, Atmospheric: 5, Medieval: 5",game,"Single-player, Steam Achievements, Steam Trading Cards","200,000 .. 500,000",1819,282,1999,1999,0,10,"English, French, German, Italian, Russian, Polish","windows, mac",2012/06/22,0,http://www.satinavs-ketten.de/?lang_new=de,https://cdn.akamai.steamstatic.com/steam/apps/203830/header.jpg?t=1594031520
1305420,Agrou,"Your new favorite Werewolf game! Seat around the fire with friends, play a villager, a werewolf or another type of character and use strategy to win!",Osmose Studio,Wankil Studio,"Casual, Indie, Strategy","Strategy: 73, Casual: 72, Indie: 63, Multiplayer: 40, Online Co-Op: 34, Werewolves: 33, Social Deduction: 29, Board Game: 23, Co-op: 22, Tactical: 21, Relaxing: 19, Family Friendly: 17, Comedy: 12",game,"Multi-player, Co-op, Steam Achievements, Steam Cloud, Online PvP, Online Co-op, PvP","200,000 .. 500,000",2030,235,499,499,0,13,"English, French, Korean, Turkish, Vietnamese",windows,2020/07/25,0,https://agrou.fr,https://cdn.akamai.steamstatic.com/steam/apps/1305420/header.jpg?t=1642178505
1515170,Maze Escape,This game is to escape the maze while avoiding zombies and obstacles. Use the item and remember the way you came to escape from the maze. Good luck.,zzong,zzong,"Adventure, Indie","Adventure: 69, Puzzle: 44, Walking Simulator: 41, Horror: 38, Zombies: 36, 3D: 29, Dark: 27, First-Person: 26, Singleplayer: 23, Psychological Horror: 22, Indie: 21, Multiple Endings: 19, Stealth: 17, Action-Adventure: 14",game,Single-player,"0 .. 20,000",1,1,99,99,0,0,English,windows,2021/01/23,0,,https://cdn.akamai.steamstatic.com/steam/apps/1515170/header.jpg?t=1611464751
531910,Bad Sector HDD,Bad Sector is a game about immunizing a data storage device while a virus works against you.,Dan Ruscoe,Dan Ruscoe,"Casual, Indie","Indie: 36, Casual: 32",game,"Single-player, Steam Achievements, Steam Trading Cards","0 .. 20,000",52,4,99,99,0,1,English,windows,2016/10/14,0,,https://cdn.akamai.steamstatic.com/steam/apps/531910/header.jpg?t=1548548101
